i,etf,코드,이름,내용,
8721,etf,SMAY,FT Cboe Vest US Small Cp Moderate Buffer ETF - May,
8722,etf,SMB,VanEck Short Muni ETF,
8726,etf,SMCP,AlphaMark Actively Managed Small Cap ETF,
8727,etf,SMDD,ProShares UltraPro Short MidCap400 ETF,
8728,etf,SMDV,ProShares Russell 2000 Dividend Growers ETF,
8729,etf,SMDY,Syntax Stratified MidCap ETF,
8733,etf,SMH,VanEck Semiconductor ETF,
8736,etf,SMI,VanEck HIP Sustainable Muni ETF,
8738,etf,SMIG,AAM Bahl & Gaynor Small/Mid Cap Income Growth ETF,
8739,etf,SMIN,iShares MSCI India Small-Cap ETF,
8740,etf,SMLE,Xtrackers S&P SmallCap 600 ESG ETF,
8741,etf,SMLF,iShares US Small-Cap Equity Factor ETF,
8744,etf,SMLV,SPDR SSGA US Small Cap Low Volatility Index ETF,
8745,etf,SMMD,iShares Russell 2500 ETF,
8748,,SMMU,PIMCO Short Term Municipal Bond Active Exch Tr Fd,
8749,etf,SMMV,iShares MSCI USA Small-Cap Min Vol Factor ETF,
8750,,SMN,ProShares UltraShort Materials,
8751,etf,SMOG,VanEck Low Carbon Energy ETF,
8752,etf,SMOT,VanEck Morningstar SMID Moat ETF,
8765,etf,SNAV,Mohr Sector Nav ETF,
8781,etf,SNLN,Highland/iBoxx Senior Loan ETF,
8785,etf,SNPD,Xtrackers S&P ESG Dividend Aristocrats ETF,
8786,etf,SNPE,Xtrackers S&P 500 ESG ETF,
8787,etf,SNPG,Xtrackers S&P 500 Growth ESG ETF,
8790,etf,SNPV,Xtrackers S&P 500 Value ESG ETF,
8793,etf,SNSR,Global X Internet of Things ETF,
