i,코드,기업명,내용,
1041,BERY,베리 글로벌 그룹,베리 글로벌 그룹Berry Global Group Inc베리 글로벌 그룹 (이전의 Berry Plastics Group Inc.)은 부가가치 플라스틱 소비자 포장 부직포 특수 재료 및 엔지니어링 재료의 공급 업체입니다.당사는 폐쇄 처방 약병 특수 필름 접착제 부직포 음료 컵 용기 및 병과 같은 제품을 제공합니다.당사는 건강 위생 및 특산품 소비자 포장 및 공학 재료의 세 부분으로 운영됩니다.소비자 포장 부문은 주로 용기 식품 서비스 품목 폐쇄 오버 캡 병 처방전 약병 튜브 및 인쇄 필름으로 구성됩니다.건강 위생 및 특수 분야는 주로 위생 감염 예방 개인 관리 산업 건설 및 여과 응용 분야에서 사용되는 부직포 특수 재료로 구성됩니다.엔지니어링 재료 부문은 주로 파이프 라인 부식 방지 솔루션 테이프 및 접착제 폴리에틸렌 기반 필름 제품 및 특수 코팅 및 라미네이트 제품으로 구성됩니다.
1043,BEST,베스트 ADR,베스트 ADRBEST Inc ADR베스트는 공급망 솔루션을 제공하고 있습니다. 당사는 온라인 및 오프라인 소매점을 통합하여 제공하는 클라우드 기반 플랫폼인 BEST Cloud를 제공합니다.사용자에게 기술 지원 솔루션을 제공합니다. 당사의 서비스 오퍼링은 BEST 공급망 관리 BEST 특급 BEST 화물 BEST 스토어+ BEST 글로벌 BEST 화물 및 BEST Ucargo입니다.BEST 공급망 관리는 웨어하우스 관리 사내 처리 및 주문 이행 서비스를 고객에게 제공하는 클라우드 OFC 운송 서비스를 제공하고 장소를 오가는 운송 서비스를 조정하는 운송 서비스 등 다양한 범주로 솔루션을 제공합니다.이 서비스는 공장에서 소비자에게 전체 트럭 적재량(FTL) LTL(트럭 부하 미만) 지역 유통 도시 내 유통 및 기타 운송 서비스를 제공합니다.BEST 스토어+는 방문 통합 국경 간 공급망 서비스를 제공합니다.
1045,BF.A,브라운-포맨 Class A,브라운-포맨 Class ABrown-Forman Corp Class A브라운-포맨은 증류주와 와인 회사이다. 이 회사는 다양한 음료 알코올 제품을 제조 증류 병 수입 수출 마케팅 및 판매한다.이 회사는 약 40개의 증류주 즉석 음료(RTD) 칵테일 및 와인 브랜드의 포트폴리오를 보유하고 있다.이 회사의 브랜드에는 Jack Daniel's Tennessee Whiskey Jack Daniel's RTDs Jack Daniel's Tennessee Honey Gentleman Jack Rare Tennessee Whiskey Jack Daniel's Tennessee Fire Jack Daniel's Single Barrel Collection Jack Daniel's Sinatra Select Jack Daniel's Winter Jack Jack Daniel's No.27 Gold Tennessee Whiskey Finlandia Vodkas Korbel California Brandy Korbel California Champagnes Woodford Reserve Kentucky Bourbons Woodford Reserve Double Oaked el Jimador Tequilas el Jimador New Mix RTDs Herradura Tequilas Sonoma-Cutrer California Wines Chambord Liqueur Old Forester Kentucky Straight Bourbon Whisky Coopers' Craft Kentucky Bourbon Antiguo Tequila Pepe Lopez Tequila Fords Gin Herradura Tequilas등이 있다.
1046,BF.B,브라운-포맨 Class B,브라운-포맨 Class BBrown-Forman Corp Class B브라운-포맨은 증류주와 와인 회사이다. 이 회사는 다양한 음료 알코올 제품을 제조 증류 병 수입 수출 마케팅 및 판매한다.이 회사는 약 40개의 증류주 즉석 음료(RTD) 칵테일 및 와인 브랜드의 포트폴리오를 보유하고 있다.이 회사의 브랜드에는 Jack Daniel's Tennessee Whiskey Jack Daniel's RTDs Jack Daniel's Tennessee Honey Gentleman Jack Rare Tennessee Whiskey Jack Daniel's Tennessee Fire Jack Daniel's Single Barrel Collection Jack Daniel's Sinatra Select Jack Daniel's Winter Jack Jack Daniel's No.27 Gold Tennessee Whiskey Finlandia Vodkas Korbel California Brandy Korbel California Champagnes Woodford Reserve Kentucky Bourbons Woodford Reserve Double Oaked el Jimador Tequilas el Jimador New Mix RTDs Herradura Tequilas Sonoma-Cutrer California Wines Chambord Liqueur Old Forester Kentucky Straight Bourbon Whisky Coopers' Craft Kentucky Bourbon Antiguo Tequila Pepe Lopez Tequila Fords Gin Herradura Tequilas등이 있다.
1047,BFAC,배터리 퓨처 애퀴지션,배터리 퓨처 애퀴지션Battery Future Acquisition Corp배터리 퓨처 애퀴지션은 기업인수목적 회사이다. 이 회사는 합병 주식 교환 자산 취득 주식 매입 자본 확충 조직 개편 또는 하나 이상의 사업체 또는 법인과 유사한 사업 결합을 위해 설립되었다.이 회사는 특정 사업 결합 대상을 선택하지 않았으며 이와 관련한 실질적인 논의를 시작하지 않았다.이 회사는 화석 연료의 전기화를 주도하는 회사에 초점을 두고있다.이 회사는 운영을 시작하거나 수익을 창출하지 않았다.
1048,BFAC.U,Battery Future Acquisition Units,Battery Future Acquisition UnitsBattery Future Acquisition Units배터리 퓨처 애퀴지션은 기업인수목적 회사이다. 이 회사는 합병 주식 교환 자산 취득 주식 매입 자본 확충 조직 개편 또는 하나 이상의 사업체 또는 법인과 유사한 사업 결합을 위해 설립되었다.이 회사는 특정 사업 결합 대상을 선택하지 않았으며 이와 관련한 실질적인 논의를 시작하지 않았다.이 회사는 화석 연료의 전기화를 주도하는 회사에 초점을 두고있다.이 회사는 운영을 시작하거나 수익을 창출하지 않았다.
1049,BFAM,브라이트 호라이즌 패밀리 솔루션,브라이트 호라이즌 패밀리 솔루션Bright Horizons Family Solutions Inc브라이트 호라이즌 패밀리 솔루션스는 육아 조기 교육 및 기타 서비스 제공 업체입니다.당사는 직원 복지 패키지의 일환으로 육아 및 기타 부양 간호 솔루션을 제공하는 고용주와 다년간 계약을 체결 한 서비스를 제공합니다.이 부문에는 풀 서비스 센터 기반 간호 서비스 백업 의존형 간호 서비스 및 기타 교육 자문 서비스가 포함됩니다.전체 서비스 센터 기반 치료 부문에는 센터 기반 보육 유치원 및 초등학교 교육이 포함됩니다.백업 의존적 치료 부문에는 센터 기반의 백업 보육 재택 간호 보육 가정에서 중병 환자 및 성인 / 노인 간호가 포함됩니다.당사의 다른 교육 자문 서비스 부문에는 대학 준비 및 입학 자문 서비스뿐만 아니라 수업료 상환 관리 및 교육 상담 서비스가 포함됩니다.당사는 영국에서 300 개가 넘는 보육원을 운영하고 있으며 전 세계에서 약 1000 개가 운영되고 있습니다.
1050,BFC,뱅크 퍼스트,뱅크 퍼스트Bank First Corp뱅크 퍼스트는 Bank First의 지주회사이다. 이 회사는 개인 및 비즈니스 고객에게 다양한 금융 서비스를 제공한다.이 은행은 독립된 지역 은행이다. 이 은행은 개인 및 비즈니스 뱅킹 서비스를 제공하며 개인 은행 서비스는 저축 수표 대출 및 전자 은행을 포함한다.개인 저축 계좌에는 CD(예금증서) 개인 퇴직 계좌(IRA) 예금 계좌 및 건강 예금 계좌가 포함된다.이 은행의 비즈니스 뱅킹 서비스에는 저축 수표 신용카드 및 재무 관리가 포함되며 예금 계좌 CDARS(CDARS) 및 건강 예금 계좌를 제공한다.이 은행은 부동산 대출 주택 지분 대출 할부 및 소비자 대출 업무 자본 신용 장비 대출 사업 확장을 위한 대출 부동산 대출 건설/개발 대출 소규모 기업 관리 대출 및 농장/생장 대출을 제공한다.
1052,BFH,브레드 파이낸셜 홀딩스,브레드 파이낸셜 홀딩스Bread Financial Holdings Inc브레드 파이낸셜 홀딩스은 미국의 금융 서비스 회사이다. 이 회사는 간편하고 개인화된 결제 대출 저축 솔루션을 제공한다.이 회사는 독점적인 소비자 직거래 신용카드 및 예금과 개인 레이블 및 공동 브랜드 신용 카드 할부 대출 후불결제 할부 판매(BNPL)을 포함하는 화이트 레이블 제품군을 제공한다.또한 이 회사는 브랜드 결제 대여 및 비용 절감을 통해 고객에게 더 많은 액세스 선택 및 자유를 제공하는 직접 소비자 솔루션을 제공한다.Comenity Mastercard는 고객이 해당 카드를 사용시 명세서 크레딧으로 지급되는 캐시백 리워드를 받을 수 있도록 한다.BNPL(Bread Split Pay)은 고객이 신용 카드나 직불 카드로 6주간 4개의 무이자 지불로 나눌 수 있한다.
1053,BFI,버거파이 인터내셔널,버거파이 인터내셔널Burgerfi International Inc버거파이 인터내셔널은 국내외 약 125개의 버거컨셉의 BurgerFi 레스토랑을 운영한다.BurgerFi는 미국산 앵거스 쇠고기를 사용한다. 이 회사의 메뉴에는 버거 치킨 + 핫도그 감자 튀김 + 양파 링 쉐이크 + 냉동 커스터드 어린이 식사 및 소스가 포함된다.이 회사의 버거 제품으로는 화이트 체다 맥앤치즈버거 버거파이 버거 버거파이 치즈버거 얼티밋 베이컨 치즈버거 비욘드 버거 등이 있다.이 회사의 치킨 + 핫도그 메뉴에는 파이 치킨 샌드위치 스파이시 파이 치킨 샌드위치 아메리칸 와규 비프 핫도그 텍사스 스타일 도그가 있다.이 회사의 감자튀김 + 어니언링 메뉴에는 갓 자른 감자튀김 어니언링 크라이 +프라이가 있다.이 회사의 쉐이크 + 냉동 커스터드 제품에는 커스터드 컵 쉐이크 및 콘크리트(아이스 디저트)가 포함된다.이 회사의 소스에는 버거파이 소스 마늘 아이올리 허니 머스타드 바베큐 및 치즈 소스가 있다.
1054,BFIN,뱅크파이낸셜,뱅크파이낸셜BankFinancial Corp뱅크파이낸셜은 BankFinancial National Association(은행)의 은행 지주 회사이다.이 은행은 상업 금융 의료 금융 장비 금융 상업용 부동산 금융을 대상으로 시카고 대도시 지역의 개인 가족 기업 및 재무 관리 비즈니스 고객에게 은행 자산 관리 및 신탁 서비스를 제공한다.이 은행은 일리노이주 Cook DuPage Lake 및 Will 카운티에 위치한 약 19개의 풀 서비스 은행과 인터넷 지점인 www.bankfinancial.com을 통해 고객에게 다양한 대출 예금 신탁 및 기타 금융 상품과 서비스를 제공한다.이 은행은 신탁 부서를 통해 신탁 및 재무 계획 서비스를 제공하며 전액 출자 자회사인 Financial Assurance Services Inc.는 대리점을 중심으로 재산 및 상해 보험 및 기타 보험 상품을 판매한다.
1057,BFK,BlackRock Municipal Income Trust,BlackRock Municipal Income TrustBlackRock Municipal Income Trust당사는 다각화된 폐쇄형 투자회사입니다. 트러스트의 투자목적은 연방정부의 정기소득세를 면제하는 경상소득을 제공하는 것입니다.신탁은 주로 연방 소득세가 면제된 지방 채권에 투자함으로써 투자 목적을 달성하고자 합니다.교통 보건 공공사업 주 세금 지원 기업 무니 교육 담배 기타 산업 지방 세금 지원 환급/에스크로 학군 주택 현금 및 파생 상품 등의 부문에 투자합니다.캘리포니아 일리노이 뉴욕 텍사스 뉴저지 앨라배마 사우스캐롤라이나 오하이오 워싱턴 컬럼비아 구역에 투자합니다.정상적인 시장 상황에서 투자 당시 투자 등급의 품질인 지방채에 자산의 80% 이상을 투자합니다.이러한 유가증권에 직접 투자하거나 파생상품의 사용을 통해 투자할 수 있습니다.트러스트의 투자 관리자 및 고문은 BlackRock Advisors LLC입니다.
1058,BFLY,버터플라이 네트워크,버터플라이 네트워크Butterfly Network Inc버터플라이 네트워크는 디지털 건강 회사이다. 이 회사는 의료 영상 시스템인 Butterfly iQ를 제공하는 데 종사하고 있다.Butterfly iQ는 반도체 기술을 사용하는 휴대용 단일 프로브 전신 초음파 시스템이다.이 제품은 전신 이미징을 수행할 수 있는 초음파 변환기인 Ultrasound-on-Chip 기술로 구동된다.이 회사의 초음파 시스템은 간호사 조산사 환자를 포함한 모든 의료 종사자가 직접 초음파 영상을 이용할 수 있도록 설계된 하드웨어 및 소프트웨어 솔루션으로 구성된다.이 회사는 의료 시스템의 임상 및 관리 인프라에 통합되어 Butterfly iQ+를 배치할 수 있는 Compass 소프트웨어가 포함된 시스템 전체의 초음파 플랫폼을 제공한다.Butterfly iQ+는 스마트폰이나 태블릿에 연결되 초음파 스캔을 수행한다.이 회사는 또한 자사의 제품을 판매하는 전자 상거래 웹 사이트를 소유하고있다.
1060,BFRG,불프로그 AI 홀딩스,불프로그 AI 홀딩스Bullfrog AI Holdings Inc.불프로그 AI 홀딩스는 디지털 바이오 제약 회사다. 이 회사는 의학 및 의료 분야의 복잡한 데이터 세트에 대한 고급 인공지능/머신러닝(AI/ML) 기반 분석에 주력한다.이 회사의 플랫폼 기술인 bfLEAP은 중개 R&D 및 임상시험 환경에서 생성되는 강력한 전임상 및 임상시험 데이터 세트와 같은 전임상 및/또는 임상 데이터 세트의 분석을 위한 잠재적으로 혁신적인 도구인 분석 AI/ML 플랫폼이다.이 플랫폼은 환자의 유전적 및 신체적 특성을 일관성 있게 파악하고 환자의 다른 이질적인 데이터 소스와 비교하여 맥락화할 수 있다.치료 파이프라인에는 siRNA와 Mebendazole이 포함된다.이 회사의 siRNA는 간세포암종(HCC) 비만 비알코올성 지방간 질환 비알코올성 지방간염과 같은 인간 질병의 치료에서 베타2-스펙트린을 표적으로 삼는다.Mebendazole은 교모세포종 표적에 주력한다.
1061,BFRI,바이오프론테라,바이오프론테라Biofrontera Inc바이오프론테라는 바이오 제약 회사이다. 이 회사는 피부병 치료를 위한 의약품의 상업화를 전문으로 한다. 이 회사의 제품은 피부암을 유발하는 피부 병변인 광선각화증의 치료에 중점을 둔다.이 회사는 세균성 피부 감염인 농가진 치료를 위한 국소 항생제를 판매한다.이 회사의 주요 제품은 Ameluz로 미국에서 광선각화증의 병변 지향 및 현장 지향 치료를 위한 광역학 요법(PDT)용 의료기기인 BF-RhodoLED 램프와 함께 사용하기 위한 처방약이다.이 회사는 황색포도상구균 또는 화농성 연쇄상구균으로 인한 일반적인 피부 감염인 농가진의 치료를 위해 Xepi를 제공한다.
1062,BFS,솔 센터스,솔 센터스Saul Centers Inc솔 센터스의 주요 사업 활동은 소득 산출 재산의 소유 관리 및 개발입니다.다음 두 세그먼트를 통해 작동합니다. 쇼핑센터와 복합용도시설입니다. Seoul Holdings Limited Partnership(운영 파트너십) 및 Saul Holdings Limited Partnerships(보조 파트너쉽)을 통해 모든 활동을 수행하고 있으며 커뮤니티 및 인근 쇼핑 센터와 혼합된 쇼핑 센터의 소유 운영 관리 임대 인수 리노베이션 확장 개발 및 자금 조달에 참여하고 있습니다.워싱턴 컬럼비아/발트랜드 메트로폴리탄 지역에 있는 부동산입니다.2016년 12월 31일 현재 49개의 쇼핑센터(쇼핑센터) 6개의 혼합사용부동산(혼용부동산) 3개의 (비운영) 개발부동산 등으로 구성되어 있습니다.
1063,BFS PR D,솔 센터스 우선주 시리즈 D 6.125%,솔 센터스 우선주 시리즈 D 6.125%Saul Ctrs 1 100 Cum DS Representing Pref Shs Series D솔 센터스의 주요 사업 활동은 소득 산출 재산의 소유 관리 및 개발입니다.다음 두 세그먼트를 통해 작동합니다. 쇼핑센터와 복합용도시설입니다. Seoul Holdings Limited Partnership(운영 파트너십) 및 Saul Holdings Limited Partnerships(보조 파트너쉽)을 통해 모든 활동을 수행하고 있으며 커뮤니티 및 인근 쇼핑 센터와 혼합된 쇼핑 센터의 소유 운영 관리 임대 인수 리노베이션 확장 개발 및 자금 조달에 참여하고 있습니다.워싱턴 컬럼비아/발트랜드 메트로폴리탄 지역에 있는 부동산입니다.2016년 12월 31일 현재 49개의 쇼핑센터(쇼핑센터) 6개의 혼합사용부동산(혼용부동산) 3개의 (비운영) 개발부동산 등으로 구성되어 있습니다.
1064,BFS PR E,솔 센터스 우선주 시리즈 E 6%,솔 센터스 우선주 시리즈 E 6%Saul Ctrs 100 DS Repstg Pref Series E솔 센터스의 주요 사업 활동은 소득 산출 재산의 소유 관리 및 개발입니다.다음 두 세그먼트를 통해 작동합니다. 쇼핑센터와 복합용도시설입니다. Seoul Holdings Limited Partnership(운영 파트너십) 및 Saul Holdings Limited Partnerships(보조 파트너쉽)을 통해 모든 활동을 수행하고 있으며 커뮤니티 및 인근 쇼핑 센터와 혼합된 쇼핑 센터의 소유 운영 관리 임대 인수 리노베이션 확장 개발 및 자금 조달에 참여하고 있습니다.워싱턴 컬럼비아/발트랜드 메트로폴리탄 지역에 있는 부동산입니다.2016년 12월 31일 현재 49개의 쇼핑센터(쇼핑센터) 6개의 혼합사용부동산(혼용부동산) 3개의 (비운영) 개발부동산 등으로 구성되어 있습니다.
1065,BFST,비즈니스 퍼스트 뱅크쉐어스,비즈니스 퍼스트 뱅크쉐어스Business First Bancshares Inc비즈니스 퍼스트 뱅크쉐어스는 Business First Bank의 지주 회사이며 루이지애나 주 금융 협회 및 금융 제품과 서비스를 제공하는 커뮤니티 기반 금융 기관입니다.이 은행은 예금과 화폐시장계좌 예금증명서 상업 및 소비자대출 주택담보대출 부동산대출 기타 할부금융 등을 제공합니다.또한 자산 관리 제품 드라이브스루 뱅킹 시설 자동 입출금기 야간 예금 개인화된 수표 신용 카드 직불 카드 인터넷 뱅킹 전자 자금 이체 서비스 국내외 자동 청결소(ACH) 서비스 여행자 수표 현금 관리 금고 서비스도 제공합니다.대출 및 예금 스위프 계정 락박스 서비스 등이 있습니다. 재무 계획 은퇴 서비스 신뢰 및 투자 관리 등을 포함하는 자산 관리 서비스입니다.
1067,BFZ,BlackRock California Municipal Income Closed Fund,BlackRock California Municipal Income Closed FundBlackRock California Municipal Income Closed Fund아이셰어즈 U.S. 헬스케어프로바이더스 ETF  이전 iShares Dow Jones U.S.Healthcare Providers Index Fund는 ETF (exchange-traded fund)입니다.본 펀드는 Dow Jones 미국 Select Health Care Providers Index (지수)의 가격 및 수익률 성과에 해당하는 투자 결과를 추구합니다.이 지수는 미국 주식 시장의 건강 유지 관리 조직의 소유자 및 운영자 병원 클리닉 치과 및 안과 치료 시설 요양원 및 재활 및 퇴직 센터 등 의료 서비스 제공 업체 부문의 성과를 측정합니다.이 펀드는 인덱스와 유사한 투자 프로파일을 가진 인덱스에 포함 된 대표적인 유가 증권 샘플에 투자합니다.이 펀드의 투자 고문은 BlackRock Fund Advisors입니다.
1068,BG,번지,번지Bunge Ltd번지는 글로벌 농업 및 식품 회사다. 이 회사의 농업 사업 부문은 농산물 및 상품 제품의 구매 보관 운송 가공 판매에 관여하는 통합 글로벌 비즈니스다.Refined and Specialty Oils 부문은 포장 및 벌크 오일과 지방 쇼트닝 마가린 마요네즈 재생 가능한 디젤 공급 원료를 포함한 식물성 기름 정제 공정에서 추출한 기타 제품 팜유 팜 커널 오일 코코넛 오일 시어 버터와 같은 식용유 제품을 생산 및 판매하고 팜유 팜 커널 오일 코코넛 오일 시어 버터를 정제 및 분획한다.Milling 부문은 주로 농부 및 딜러로부터 직접 밀과 옥수수를 구매하여 식품 가공업체 제과점 양조장 스낵 식품 생산업체 및 기타 고객을 위한 제분 제품으로 가공하는 밀 및 옥수수 제분 사업으로 구성된다.Sugar and Bioenergy 부문은 주로 BP Bunge Bioenergia에 대한 50% 지분과 소량의 에탄올 유통 판매 활동으로 구성된다.
1069,BGB,Blackstone Strategic Credit 2027 Term Fund,Blackstone Strategic Credit 2027 Term FundBlackstone Strategic Credit 2027 Term FundBlackstone/GSO Strategic Credit Fund는 다각화된 폐쇄형 경영투자회사다.이 펀드의 1차 투자목표는 고현금소득이며 2차 투자목표는 자본의 보존을 추구하는 것으로 펀드의 주된 투자목표는 고현금소득을 추구하는 것이다.이 펀드는 주로 다양한 포트폴리오 또는 1차 및 2차 대출을 포함한 대출 만기가 다양한 고수익 회사채 등 고정 수익 상품에 투자한다.기업고정소득상품과 그 밖의 경제적 특성이 비슷한 투자(파생상품 포함)로 구성된 신용투자에 관리자산의 80% 이상을 보유해야 한다.그 펀드는 의료와 제약 서비스 사업 건설과 건축 은행 금융 보험과 부동산 첨단 기술 산업을 포함한 다양한 분야에 투자한다.GSO / Blackstone Biddle Funds Management LLC는 펀드의 투자자문 역할을 한다.
1070,BGCP,BGC 파트너스,BGC 파트너스BGC Partners IncBGC 파트너스는 금융 기술 회사이다. 이 회사는 BGC GFI Sunrise Brokers Besso Ed Broking Poten & Partners RP Martin CORANT CORANT GLOBAL을 비롯한 다양한 금융 브랜드 서비스를 소유하고 있다.이 회사는 또한 다양한 금융 및 비금융 기관에 거래 실행 청산 압축 및 기타 거래 후 서비스 정보 및 기타 백오피스 서비스를 포함한 다양한 서비스를 제공한다.이 회사는 Fenics Fenics Market Data Fenics GO BGC BGC Trader Capitalab Lucera 등의 브랜드를 통해 금융 기술 솔루션 시장 데이터 및 금융 상품 및 시장과 관련된 분석을 제공한다.이 회사의 시스템은 매칭 신용 관리 시장 데이터 배포 위치 보고 고객 표시 및 고객 통합을 제공하는 계층화된 구성 요소로 이루어진다.이 회사의 고객은 은행 브로커-딜러 투자 은행 무역 회사 및 기타 여러 회사를 포함한다.
1071,BGFV,빅 5 스포팅 구즈,빅 5 스포팅 구즈Big 5 Sporting Goods Corp빅 5 스포팅 구즈는 미국 서부의 스포츠 용품 소매 업체이다. 이 회사는 자회사 인 Big 5 Corp.을 통해 사업을 운영한다.이 회사는 Big 5 Sporting Goods라는 이름으로 약 431개의 매장과 전자상거래 플랫폼을 운영중이다.이 회사는 평균 약 11000평방피트의 전통적인 스포츠 용품 매장 형식으로 풀 라인 제품을 제공한다.이 회사는 운동화 의류 및 액세서리뿐만 아니라 팀 스포츠 피트니스 캠핑 사냥 낚시 홈 레크레이션 테니스 골프 겨울 및 여름 레크레이션을 위한 다양한 야외 및 운동 장비를 판매한다.이 회사는 매장에서 adidas Coleman Columbia Everlast New Balance Timex Nike Rawlings Skechers Spalding Under Armour 및 Wilson을 비롯한 다양한 브랜드 제조업체의 제품을 제공한다.이 회사는 Big 5 Corp.의 자회사인 Big 5 Services Corp.를 통해 기프트 카드 사업도 진행한다.
1073,BGI,버크스 그룹,버크스 그룹Birks Group Inc버크스 그룹은 보석 시계 선물용 악세사리의 디자이너이자 캐나다의 고급 보석 매장 운영자이다.이 회사는 소매와 기타의 두 부문을 통해 운영된다. 이 회사의 소매 부문은 캐나다에서 Maison Birks 브랜드로 약 27개 매장 Brinkhaus 브랜드로 캘거리에서 1개 Graff 및 Patek Philippe 브랜드로 밴쿠버에 2개 소매점을 운영하는 소매 운영으로 구성된다.이 회사의 기타 부문은 주로 도매 사업 전자 상거래 사업 금 교환 사업으로 구성된다.이 회사의 보석 컬렉션은 영국의 일부 Mappin & Webb 및 Goldsmiths 매장 미국의 Mayors 매장 및 북미 전역의 특정 보석 소매점에서도 구입이 가능하다.
1075,BGNE,베이진 ADR,베이진 ADRBeigene Ltd ADR이 회사는 글로벌 생명공학 회사이다. 이 회사는 종양 치료제를 개발하고 상용화하는 데 주력하고 있다. 이 회사는 다양한 혈액암 치료를 위한 Bruton의 Tyrosine Kinase(BTK) 소분자 억제제인 BRUKINSA 다양한 고형 종양 및 혈액암 치료를 위한 항-PD-1 항체 면역요법인 티스렐리주맙(tislelizumab)  및 PARP1 및 PARP2의 선택적 소분자 억제제인 파미파립등을 보유하고 있다.이 회사는 미국 중국 유럽 연합 영국 캐나다 및 호주에서 BRUKINSA를 시판할 수 있는 승인을 받았다.이 회사는 중국 시장에 13개의 승인된 의약품을 유통할 수 있는 권리가 있다.BRUKINSA는 BTK 점유율을 최대화하고 표적외 결합 효과를 최소화하도록 설계된 BTK(Bruton's Tyrosine Kinase)의 2세대 소분자 억제제이다.
