i,코드,기업명,내용,
0,백광산업,애질런트 테크놀로지스,애질런트 테크놀로지스Agilent Technologies Inc애질런트 테크놀로지스는 전체 실험실 워크플로우를 위한 계측기 소프트웨어 서비스 및 소모품을 포함하는 애플리케이션 중심 솔루션을 제공하는 기업이다.생명 과학 진단 및 응용 화학 시장에서 사업을 운영하고 있다. 생명 과학 및 응용 시장 비즈니스는 고객이 물질 및 제품의 물리적 생물학적 특성을 식별 정량화 및 분석할 수 있는 계측기 및 소프트웨어를 포함한 응용 분야 중심 솔루션을 제공한다.진단 및 유전체학 사업은 6개의 활동 영역으로 구성되어 있으며 올리고 기반 치료제를 위한 활성 제약 성분과 임상 및 생명과학 연구 분야의 고객이 세포 및 분자 수준에서 샘플을 조사할 수 있는 시약 기기 소프트웨어 및 소모품이 포함된 솔루션을 제공한다.제품 카테고리에는 액체 크로마토그래피 시스템 및 구성 요소와 액체 크로마토그래피 질량 분석 시스템이 포함된다.
1,AA,알코아,알코아Alcoa Corp알코아은 무역 회사이다. 이 회사는 보크사이트 알루미나 알루미늄 제품의 생산에 종사하고 있다.이 회사의 운영은 세 가지 보고 가능한 사업 부문인 보크사이트와 알루미나 알루미늄으로 구성되어 있다.보크사이트 및 알루미나 부문은 주로 Alcoa Corporation과 Alumina Limited 간의 합작 투자회사인 AWAC(Alcoa World Alumina and Chemicals)에서 보유한 일련의 계열사 운영 법인으로 구성되어 있다.알루미늄 부문은 에너지 생산 사업과 더불어 회사의 알루미늄 제련 주조 압연 사업으로 구성되어 있다.보크사이트 부문은 회사의 글로벌 보크사이트 채굴 사업부로 구성된다.이 회사의 알루미나 부문은 보크사이트를 알루미나로 가공하는 회사의 세계적인 정제 시스템으로 구성된다.알루미늄 부문은 브라질 캐나다 미국의 에너지 자산 포트폴리오인 전 세계 제련 및 주조 공장 시스템으로 구성되어 있다.이 회사는 9개국에 28개 이상의 영업소를 가지고 있다.
4,AAC,아레스 애퀴지션,아레스 애퀴지션Ares Acquisition Corp아레스 애퀴지션 Class A는 기업 인수 목적 회사이다. 이 회사는 합병 자본 증권 교환 자산 취득 주식 매입 조직 개편 또는 이와 유사한 사업 조합을 취하기 위해 설립되었다.이 회사는 특정 기업결합 대상을 선택하지 않았다. 이 회사는 모든 산업분야와 지역에서 기업결합 목표를 추구할 수 있다.
5,AAC.U,Ares Acquisition Units,Ares Acquisition UnitsAres Acquisition Units아레스 애퀴지션 Class A는 기업 인수 목적 회사이다. 이 회사는 합병 자본 증권 교환 자산 취득 주식 매입 조직 개편 또는 이와 유사한 사업 조합을 취하기 위해 설립되었다.이 회사는 특정 기업결합 대상을 선택하지 않았다. 이 회사는 모든 산업분야와 지역에서 기업결합 목표를 추구할 수 있다.
6,AACG,ATA 크리에이티비티 글로벌 ADR,ATA 크리에이티비티 글로벌 ADRATA Creativity Global ADRATA 크리에이티비티 글로벌은 주로 국제 교육 서비스를 제공하는 중국 기반 회사이다.이 회사의 주요 사업은 학생들의 창의력 함양 및 향상과 관련된 국제 교육 경험을 제공하는 것이다.이 회사의 주요 제품 및 서비스는 해외 미술 공부에 관심이 있는 중국 학생들에게 제공하는 포트폴리오 교육 서비스이다.
7,AACI,아마다 애퀴지션 I,아마다 애퀴지션 IArmada Acquisition Corp I아마다 애퀴지션 I는 기업인수목적회사이다. 이 회사는 합병 자본 증권 교환 자산 취득 주식 매입 조직 개편 또는 하나 이상의 사업과 유사한 사업 결합을 수행할 목적으로 형성되었다.이 회사는 디지털 온라인 모바일 결제 솔루션 처리 및 게이트웨이 서비스 POS 기술 소비자 참여 플랫폼 전자상거래를 제공하는 금융 서비스 산업(FinTec)에 대상 비즈니스에 집중할 계획이다.이 회사는 운영되지 않으며 어떠한 수익도 창출하지 않는다.
8,AACIU,Armada Acquisition I Units,Armada Acquisition I UnitsArmada Acquisition I Units아마다 애퀴지션 I는 기업인수목적회사이다. 이 회사는 합병 자본 증권 교환 자산 취득 주식 매입 조직 개편 또는 하나 이상의 사업과 유사한 사업 결합을 수행할 목적으로 형성되었다.이 회사는 디지털 온라인 모바일 결제 솔루션 처리 및 게이트웨이 서비스 POS 기술 소비자 참여 플랫폼 전자상거래를 제공하는 금융 서비스 산업(FinTec)에 대상 비즈니스에 집중할 계획이다.이 회사는 운영되지 않으며 어떠한 수익도 창출하지 않는다.
9,AACT,Ares Acquisition Corporation II,아레스 애퀴지션 IIAres Acquisition Corporation II아레스 애퀴지션 II은 블랭크 체크 회사다. 이 회사는 기업 인수 목적 회사다.
10,AACT.U,Ares Acquisition Units Class A,Ares Acquisition Units Class AAres Acquisition Units Class A아레스 애퀴지션 II은 블랭크 체크 회사다. 이 회사는 기업 인수 목적 회사다.
11,AADI,아디 바이오사이언스,아디 바이오사이언스Aadi Bioscience Inc아디 바이오사이언스는 임상 단계의 바이오 제약 회사이다. 이 회사는 유전 암에 대한 정밀 치료법 개발에 관여한다. 이 회사는 TSC1 또는 TSC2 유전자 변경과 같은 mTOR 경로 드라이버 변경이 있는 암 환자를 위한 치료법을 개발한다.이 회사의 주요 제품인 FYARROTM은 인간 알부민에 결합된 mTOR 억제제로서 전임상단계에서 다른 mTOR 억제제에 비해 종양 축적 mTOR 표적 억제 및 종양 성장 억제성이 높은것으로 나타났다.이 회사의 FYARROTM 제품은 진행성 혈관주위 상피양 세포 종양(PEComa) 환자를 대상으로한 nab-sirolimus ABI-009에 대한 2상 등록 시험을 진행 중이다.
13,AAIC,알링턴 에셋 인베스트먼트,알링턴 에셋 인베스트먼트Arlington Asset Investment Corp알링턴 에셋 인베스트먼트는 투자회사로 기관(agency) 주택 담보부 증권(MBS)과 프라이빗 레이블(private-label) MBS로 구성된 주택담보대출저당증권의 레버드 포트폴리오(levered portfolio)를 인수 및 보유하는 사업을 한다.기관 MBS의 경우 연방 저당권 협회(Fannie Mae) 연방 주택 금융 저당 회사(Freddie Mac)와 같은 미국 정부 기관이나 정부 후원 기업(GSE)이 원리금 지급을 보증하는 주택 담보 대출 패스스루 증명서를 포함한다.프라이빗 레이블(private-label) MBS 또는 비기관(non-agency) MBS와 같은 경우에는 GSE 또는 미(美)정부가 보증하지 않는 주택담보부증권을 포함한다.이 기업은 주로 단기 금융 계약을 통해 투자 자금을 확보한다. 또한 증권 중개인이나 그와 상응하는 업체를 통해 최초 기업 공개된 또는 유통시장(secondary market)에 상장된 기관 MBS를 매입한다.이 기업은 변동금리 저당대출(ARM) 또는 혼합형 ARM에 의해 담보된 기관 MBS에 투자할 수 있다.
14,AAIC PR B,알링턴 에셋 인베스트먼트 우선주 시리즈 B 7%,알링턴 에셋 인베스트먼트 우선주 시리즈 B 7%Arlington Asset Investment 7 00 Cumulative Perpetual Redeemable Preferred알링턴 에셋 인베스트먼트는 투자회사로 기관(agency) 주택 담보부 증권(MBS)과 프라이빗 레이블(private-label) MBS로 구성된 주택담보대출저당증권의 레버드 포트폴리오(levered portfolio)를 인수 및 보유하는 사업을 한다.기관 MBS의 경우 연방 저당권 협회(Fannie Mae) 연방 주택 금융 저당 회사(Freddie Mac)와 같은 미국 정부 기관이나 정부 후원 기업(GSE)이 원리금 지급을 보증하는 주택 담보 대출 패스스루 증명서를 포함한다.프라이빗 레이블(private-label) MBS 또는 비기관(non-agency) MBS와 같은 경우에는 GSE 또는 미(美)정부가 보증하지 않는 주택담보부증권을 포함한다.이 기업은 주로 단기 금융 계약을 통해 투자 자금을 확보한다. 또한 증권 중개인이나 그와 상응하는 업체를 통해 최초 기업 공개된 또는 유통시장(secondary market)에 상장된 기관 MBS를 매입한다.이 기업은 변동금리 저당대출(ARM) 또는 혼합형 ARM에 의해 담보된 기관 MBS에 투자할 수 있다.
15,AAIC PR C,알링턴 에셋 인베스트먼트 우선주 시리즈 C,알링턴 에셋 인베스트먼트 우선주 시리즈 CArlington Asset Investment 8.250 Cumulative Redeemable Prf Shs Series C알링턴 에셋 인베스트먼트는 투자회사로 기관(agency) 주택 담보부 증권(MBS)과 프라이빗 레이블(private-label) MBS로 구성된 주택담보대출저당증권의 레버드 포트폴리오(levered portfolio)를 인수 및 보유하는 사업을 한다.기관 MBS의 경우 연방 저당권 협회(Fannie Mae) 연방 주택 금융 저당 회사(Freddie Mac)와 같은 미국 정부 기관이나 정부 후원 기업(GSE)이 원리금 지급을 보증하는 주택 담보 대출 패스스루 증명서를 포함한다.프라이빗 레이블(private-label) MBS 또는 비기관(non-agency) MBS와 같은 경우에는 GSE 또는 미(美)정부가 보증하지 않는 주택담보부증권을 포함한다.이 기업은 주로 단기 금융 계약을 통해 투자 자금을 확보한다. 또한 증권 중개인이나 그와 상응하는 업체를 통해 최초 기업 공개된 또는 유통시장(secondary market)에 상장된 기관 MBS를 매입한다.이 기업은 변동금리 저당대출(ARM) 또는 혼합형 ARM에 의해 담보된 기관 MBS에 투자할 수 있다.
16,AAIN,알링턴 에셋 인베스트먼트 선순위 채권 6.000% 만기 2026년,알링턴 에셋 인베스트먼트 선순위 채권 6.000% 만기 2026년Arlington Asset Investment 6 000 Senior Notes Due 2026알링턴 에셋 인베스트먼트는 투자회사로 기관(agency) 주택 담보부 증권(MBS)과 프라이빗 레이블(private-label) MBS로 구성된 주택담보대출저당증권의 레버드 포트폴리오(levered portfolio)를 인수 및 보유하는 사업을 한다.기관 MBS의 경우 연방 저당권 협회(Fannie Mae) 연방 주택 금융 저당 회사(Freddie Mac)와 같은 미국 정부 기관이나 정부 후원 기업(GSE)이 원리금 지급을 보증하는 주택 담보 대출 패스스루 증명서를 포함한다.프라이빗 레이블(private-label) MBS 또는 비기관(non-agency) MBS와 같은 경우에는 GSE 또는 미(美)정부가 보증하지 않는 주택담보부증권을 포함한다.이 기업은 주로 단기 금융 계약을 통해 투자 자금을 확보한다. 또한 증권 중개인이나 그와 상응하는 업체를 통해 최초 기업 공개된 또는 유통시장(secondary market)에 상장된 기관 MBS를 매입한다.이 기업은 변동금리 저당대출(ARM) 또는 혼합형 ARM에 의해 담보된 기관 MBS에 투자할 수 있다.
17,AAL,아메리칸 에어라인스 그룹,아메리칸 에어라인스 그룹American Airlines Group Inc아메리칸 에어라인스 그룹은 지주 회사다. 주요 사업 활동은 네트워크 항공사의 운영이다. 회사는 지역 항공사 자회사 및 타사 지역 항공사와 함께 American Eagle 브랜드로 운영하며 샬럿 시카고 댈러스/포트워스 로스앤젤레스 마이애미 뉴욕 필라델피아 피닉스 워싱턴 컬럼비아 특별구의 허브와 런던 도하 마드리드 시애틀/타코마 시드니 및 도쿄를 포함한 파트너 게이트웨이를 통해 승객 및 화물을 위한 정기 항공 운송 서비스를 제공한다.이 회사의 자회사로는 American Airlines Inc. Envoy Aviation Group Inc. PSA Airlines Inc.및 Piedmont Airlines Inc. 등이 있다. 화물 사업부는 전 세계에 시설과 인터라인 연결을 통해 다양한 화물 및 우편 서비스를 제공한다.이 회사는 지역 항공사 자회사 및 타사 지역 항공사가 지원하는 925대의 메인 노선 항공기를 운영하며 추가로 536대의 지역 항공기를 운항한다.
20,AAMC,알티소스 에셋 매니지먼트,알티소스 에셋 매니지먼트Altisource Asset Management Corp알티소스 에셋 매니지먼트는 서비스가 부족한 시장에 유동성과 자본을 제공하는 대체 대출 회사이다.이 회사는 ALG(Alternative Lending Group)를 만들고 Crypto ATM과 관련된 기회를 추구하는 데 중점을 두고있다.이 회사의 주요 사무소는 미국령 버진 아일랜드에 있으며 자회사인 AAMC US Inc.와 Finsight Business Solutions Private Limited를 통해 미국과 인도에서도 사업을 운영하고 있다.이 회사의 다른 자회사로는 Altisource Consulting S.a r.l NewSource Reinsurance Company Ltd. AAMC CM WY LLC AAMC EBO Fund Holdings LLC AAMC GP LLC Grapetree Lending LLC 등이 있다.
21,AAME,아틀란틱 아메리칸,아틀란틱 아메리칸Atlantic American Corp아틀란틱 아메리칸은 생명과 건강 재산 및 상해 보험 산업 내의 전문 시장에서 자회사를 통해 영업하는 지주회사입니다.본 회사의 주요 운영 자회사는 미국 남부 보험 회사와 손해 보험 산업 내의 미국 남부 안전 보험 회사(총칭 미국 남부)와 은행 피델리티 생명 보험 회사(총칭 뱅크스 피델리티)입니다.American Southern과 Bankers Fidelity는 각각 제공되는 제품의 유형에 따라 별도로 관리됩니다.American Southern의 제품군에는 비즈니스 자동차 보험 정책 일반 책임 보험 정책 재산 보험 정책 및 Surey Bonds가 포함됩니다.Bankers Fidelity에서 제공하는 제품에는 일반 생명 보험 의료 보험 기타 사고 및 의료 보험 제품이 포함됩니다.
22,AAN,아론스 컴퍼니,아론스 컴퍼니Aaron's Company Inc아론스 컴퍼니는 LTO (Leask-to-LTO) 솔루션의 옴니채널 제공 업체이다.이 회사는 Aarons.com 전자 상거래 플랫폼을 통해 가구 가전 제품 소비자 전자 및 액세서리의 직접 소비자 판매 및 임대 소유권을 제공한다.이 회사의 운영에는 Woodhaven Furniture Industries (우드헤븐)이 포함되어 있으며 침구의 대부분과 회사 운영 및 프랜차이즈 상점에서 임대 및 판매 된 가구의 일부를 임대하고 판매한다.고객은 Aarons.com 전자 상거래 플랫폼을 통해 상품을 탐색하고 임대계약 및 리스 거래를 할수있다.이 회사는 캐나다 47개 주에서 약 1300 명의 회사 및 프랜차이즈 매장을 보유하고 있으며 이는 독립적 인 프랜차이즈가 허가 된 기준으로 소유하고 운영된다.
23,AAOI,어플라이드 옵토일렉트로닉스,어플라이드 옵토일렉트로닉스Applied Optoelectronics Inc어플라이드 옵토일렉트로닉스는 구성 요소 모듈 및 장비를 포함한 고급 광학 제품의 개발 및 제조에 종사하고 있다.이 회사의 제품은 인터넷 데이터 센터 케이블 텔레비전(CATV) 통신 및 FTTH(Fiber-to-the-Home) 시장에서 사용되는 광대역 광섬유 액세스 네트워크용 빌딩 블록이다.이 회사는 구성 요소 하위 어셈블리 및 모듈에서 완전한 턴키 장비에 이르기까지 다양한 통합 수준에서 다양한 광통신 제품을 설계 및 제조한다.이 회사는 4개 시장 모두의 고객에게 광학 네트워킹 레이저 구성 요소 및 장비를 공급한다.이 회사는 MBE(Molecular Beam Epitaxy) 및 MOCVD(Metal Organic Chemical Vapor Deposition) 공정을 사용하여 아날로그 및 디지털 레이저를 설계 제조 및 통합하고 타이페이 대만 닝보 중국에 회사 제조 시설을 갖추고 있다.
24,AAON,에이에이온,에이에이온Aaon Inc에이에이온은 프리미엄 냉난방 장비의 엔지니어링 제조 마케팅 및 판매에 종사한다.이 회사는 AAON Oklahoma AAON Coil Products BASX의 3개 사업부를 통해 사업을 운영한다.AAON Oklahoma 부문은 표준형 반주문형 맞춤형 냉난방 및 공조(HVAC) 시스템을 설계 제조 판매 및 서비스하고 모든 HVAC 장치를 위한 제어 솔루션을 설계 및 생산한다.또한 오클라호마주 털사에 있는 두 개의 소매 부품 매장과 온라인을 통해 고객에게 소매 부품을 판매한다.AAON Coil Products 부문은 다양한 표준 반주문형 맞춤형 HVAC 시스템을 설계하고 제조한다.BASX 부문은 데이터 센터 냉각 솔루션 클린룸 HVAC 시스템 상업용/산업용 HVAC 시스템 모듈식 솔루션을 포함한 맞춤형 엔지니어링 공기 처리 시스템의 제품 개발 설계 및 제조를 제공한다.또한 BASX는 무균실 환경 제어 시스템을 설계 및 제조한다.
25,AAP,어드밴스 오토 파츠,어드밴스 오토 파츠Advance Auto Parts Inc어드밴스 오토 파츠는 북미의 자동차 애프터마켓 부품 공급업체로서 전문 설치자(Professional) 및 DIY(Do-it-Yourself) 고객은 물론 독립적으로 소유한 운영자에게 서비스를 제공한다.이 회사의 매장과 지점은 국산 및 수입차 승합차 스포츠 유틸리티 차량 경량 및 대형 트럭을 위한 브랜드 OEM(Original Equipment Manufacturer) 및 자가 상표 자동차 교체 부품 액세서리 배터리 및 유지보수 품목을 제공한다.이 회사는 북부 부문 남부 부문 Carquest Canada Independents Worldpac의 5개 부문을 통해 운영된다.이 회사는 주로 Advance Auto Parts Autopart International Carquest 및 Worldpac이라는 상표명으로 약 4706개의 총 매장과 266개의 지점을 운영한다.이 회사는 부품 및 배터리 액세서리 및 화학 물질 및 엔진 유지 보수를 포함한 범주에 따라 제품을 제공한다.
28,AAPL,애플,애플Apple Inc애플은 스마트폰 개인용 컴퓨터 태블릿 웨어러블 및 액세서리를 설계 제조 판매하는 회사이다.이 회사의 제품에는 iPhone Mac iPad 웨어러블 홈 액세서리가 있다.이 회사의 iPhone은 iOS 운영 체제를 기반으로 하는 스마트폰 제품군이다.이 회사의 Mac은 macOS 운영 체제를 기반으로 하는 개인용 컴퓨터 제품군이다.이 회사의 iPad는 iPadOS 운영 체제를 기반으로 하는 다목적 태블릿 제품군이다.이 회사의 웨어러블 홈 및 액세서리에는 AirPods Apple TV Apple Watch Beats 제품 HomePod iPod touch 기타 Apple 브랜드 및 타사 액세서리가 포함된다.이 회사의 AirPod은 Siri와 상호 작용하는 무선 헤드폰이다.이 회사의 Apple Watch는 스마트 워치 라인이다. 이 회사의 서비스에는 광고 AppleCare 클라우드 서비스 디지털 콘텐츠 지불 서비스가 포함된다.이 회사의 고객으로는 주로 일반 소비자 중소기업 교육 기업 및 정부 등이 있다.
30,AAT,아메리칸 애셋츠 트러스트,아메리칸 애셋츠 트러스트American Assets Trust Inc아메리칸 애셋츠 트러스트는 수직 통합 및 자체 관리 부동산 투자 신탁 (Reit)이다.이 회사는 남부 캘리포니아 북부 캘리포니아 오레곤 워싱턴 텍사스 하와이의 고품질의 사무실 소매 다가구 및 복합 용도의 부동산을 소유하고 운영 멀티 플램 및 혼합 사용 속성을 개발한다.회사는 사무실 소매 멀티 파이 믹스 및 혼합 사용 4 개의 비즈니스 부문에서 운영된다.이 회사의 포트폴리오는 약 12 개의 소매 쇼핑 센터와. 11 개 이상의 사무실 약 369 올스위트 호텔룸 소매 쇼핑 센터로 구성된 혼합 사용 부동산 6 개 이상의 다용도 부동산등으로 구성된다.또한 이 회사는 개발 및 건설을 위한 3개의 부동산을 소유하고 있다.이 회사 시장에는 캘리포니아의 샌프란시스코 오레곤의 포틀랜드 워싱턴의 벨뷰 오 하와이이 오아후가 포함된다.
31,AAU,알마덴 미네랄스,알마덴 미네랄스Almaden Minerals Ltd알마덴 미네랄스는 광물 프로젝트 탐사 및 개발 사업에 종사하는 캐나다 기반의 회사이다.이 회사의 주요 자산은 멕시코의 Tuligtic에 위치한 Ixtaca 귀금속 프로젝트이다.Ixtaca의 금 및 은등의 광물은 탄산염(석회암 및 혈암) 및 화산암을 절단하는 열광 광맥 및 광맥에서 일렉트럼 금/은 합금 또는 금 및 은 함유 황화물로 부터 발생한다.이 회사는 멕시코 Puebla 주에 있는 Ixtaca 프로젝트의 100%를 소유하고 있으며 Almadex Minerals Ltd가 보유한 2.0%의 순 제련소 수익(NSR) 로열티의 적용을 받는다. Ixtaca 광상은 약 138만 온스의 금과 8510만 온스의 은 매장량을 보유하고 있다.그 중 0.59g/t Au 및 36. 3g/t Ag 등급이 약 7310만 톤이다.
33,AB,AllianceBernstein Holding Units,AllianceBernstein Holding UnitsAllianceBernstein Holding Units얼라이언스번스타인 홀딩은 3 개의 구매자 유통 채널인 기관 소매 및 사유 자산 관리 그리고 판매자 사업인 번스타인 리서치 서비스를 통해 다양한 고객에게 연구 투자 관리 및 관련 서비스를 제공하고 있습니다.당사는 가치 성장 및 주식을 포함한 자본화 범위 및 투자 전략 전반에 걸쳐 글로벌 포트폴리오 및 지역 포트폴리오 주식 전략 과세 및 비과세 전략 전통 채권 전략 소극적 관리의 지수 및 향상된 지수 전략 헤지 펀드 재간접펀드 및 사모 주식 동적 자산 배분 맞춤형 목표 일식 펀드 및 목표 위험 펀드를 포함한 다중 자산 솔루션 및 서비스 대체 투자의 다양한 투자 서비스를 제공합니다.당사의 서비스는 시가 총액 기간 및 위치를 비롯한 다양한 투자 원칙을 포괄합니다.
35,ABC,아메리소스버겐,아메리소스버겐Amerisourcebergen Corp아메리소스버겐은 글로벌 제약 소싱 및 유통 서비스 회사이다. 이 회사는 미국의 의료 솔루션 및 국제 건강 관리 솔루션의 두 부분을 통해 운영된다.미국 의료 솔루션 부문은 비예약 병원 소매 약국 우편 주문 약국 의료 클리닉둥을 포함한 다양한 건강 관리 제공자에게 전문 브랜드 및 일반 제약 비처방 의료 제품 가정 건강 관리 및 관련 서비스를 제공한다.국제 건강 관리 솔루션 부문은 국제 제약 도매 및 관련 서비스 운영 및 글로벌 상업화 서비스에 중점을 둔 기업으로 구성된다.이 부문은 Alliance Healthcare World Courier Innomar Profarma Profarma Specialty로 구성된다.
36,ABCB,아메리스 뱅코프,아메리스 뱅코프Ameris Bancorp아메리스 뱅코프는 Ameris Bank의 은행 지주 회사이다. 이 은행은 조지아 앨라배마 플로리다 노스캐롤라이나 및 사우스캐롤라이나의 약 165개 지역에서 소매 및 상업 고객에게 모든 범위의 은행 서비스를 제공한다.이 은행의 사업부는 상업 대출 소비자 대출 및 예금 계좌를 포함한 완전한 금융 서비스를 제공한다.소매 담보대출 부서는 1-4인 가구 주택 담보 대출의 판매 및 서비스를 담당한다.창고 대부 사업부서는 기본 1-4 가족 주택 담보 대출 및 주택 담보 서비스 권리로 확보되는 다른 사업체에 대한 창고 라인의 제공 및 서비스에 종사하고 있다.SBA 사업부는 소기업 관리 대출의 개시 판매 및 서비스를 담당한다.프리미엄 금융 부문은 상업 보험 보험료 금융 대출의 시작 및 서비스에 종사하고 있다.
37,ABCL,앱셀레라 바이오로직스,앱셀레라 바이오로직스Abcellera Biologics Inc앱셀레라 바이오로직스는 자연 면역체계를 검색·분석해 질병을 예방하고 치료하는 약물발견 플랫폼을 제공하는 생명공학 기업이다.이 플랫폼은 엔지니어링 마이크로 유체학 단일 셀 분석 high-throughput(하이-스루풋) 유전학 기계 학습 및 데이터 과학의 기술 도구를 통합한다.이 회사는 항체 기반 약물을 추출하기 위해 의료연구 및 개발에 다중 기술을 적용하는 사업을 하고있다.이 솔루션을 통해 납 항체를 소싱 검색 디코딩 엔지니어링 및 전달할 수 있습니다.이 회사의 솔루션을 통해 선두 항체를 공급 검색 디코딩 엔지니어링 전달할 수 있다.이 회사의 자회사로는 AbCellera Properties Inc. AbCellera Properties Columbia Inc. AbCellera US Holdings Inc. Channel Biologics Pty Ltd. Lineage Biosciences Inc. Trianni Inc.등이 있다.
