i,코드,기업명,내용,
2223,CTG,컴퓨터 태스크 그룹,컴퓨터 태스크 그룹Computer Task Group Inc컴퓨터 태스크 그룹은 북미 및 남미 서유럽 및 인도에서 운영되는 정보 및 기술 솔루션 회사이다.이 회사는 고객에게 정보 기술(IT) 및 관련 서비스를 제공한다.이 회사의 디지털 변환 솔루션 포트폴리오에는 비즈니스 프로세스 변환 솔루션 기술 변환 솔루션 및 운영 변환 솔루션의 세 가지 서비스가 포함된다.비즈니스 프로세스 변환 솔루션 서비스에는 자문 데이터 전략 디지털 작업 공간 엔터프라이즈 플랫폼 정보 공개 규제 및 규정 준수가 포함된다.기술 혁신 솔루션 서비스에는 애플리케이션 개발 자동화 클라우드 데이터 관리 엔터프라이즈 플랫폼 구현 및 테스트가 포함된다.운영 혁신 솔루션 서비스에는 애플리케이션 지원 IT 운영 지원 클라우드 및 인프라가 포함된다.이 회사는 또한 고객에게 직원채용 서비스를 제공한다.
2224,CTGO,콘탱고 오르,콘탱고 오르Contango ORE Inc콘탱고 오르는 알래스카 주에서 금 은 구리 광석 탐사에 참여하는 회사이다.이 회사는 Tetlin의 원주민 마을과 공동으로 진행하는 광물 임대 탐사에 중점을 두고있다.Tetlin의 원주민 마을 정부 기관은 약 675000에이커에 달하는 알래스카주 톡(Tok) 근처의 광물 탐사를 위한Tetlin 부족 위원회이며 Manh Choh Joint Venture Property를 구성하고있다.Manh Choh Joint Venture Property는 알래스카 동부 내륙의 Tetlin Hills 및 Mentasta 산맥에 위치하고 있으며 Fairbanks 시에서 남동쪽으로 약 300km 알래스카주 Tok에서 남동쪽으로 20km 떨어져 있다.Manh Choh Joint Venture Property가 보유하고 있는 Tetlin 임대 및 채굴 청구권에는 Eagle Triple Z Noah Shamrock Tetlin-Village 및 Tetlin-Tok이 포함된다.
2225,CTHR,찰스 & 콜바드,찰스 & 콜바드Charles & Colvard Ltd찰스 & 콜바드는 모이사나이트 원석 브랜드인 Forever One을 포함하여 모이사나이트를 사용한 Charles & Colvard Created Moissanite(모이사나이트) 및 완성된 보석을 제조 판매 유통하는 회사이다.또한 이 회사는Caydia 연구소에서 성장한 다이아몬드와 연구소에서 성장한 다이아몬드를 특징으로 하는 완성품 보석을 판매 및 유통한다.이 회사는 전통부문과 온라인채널 부문의 두 가지 부문을 통해 운영된다.디지털 자산 구성요소를 포함하는 온라인 채널 부문은 charlesandcolvard.com 웹사이트 시장을 포함한 전자상거래 아울렛 직송 고객 및 기타 전자상거래 고객으로 구성된다.전통적 부문은 국내 및 국제 유통업체 및 소매 고객으로 구성된다.이 회사는 루스 모이사나이트 보석 루스 랩 그로운 다이아몬드 모이사나이트와 랩 그로운 다이아몬드가 모두 포함된 완성품 보석을 유통업체 제조업체 소매업체 및 디자이너에게 판매한다.이 회사의 완성품 보석과 루스 모이사나이트 보석은 소매점과 인터넷을 통해 판매된다.
2226,CTIB,윤홍 CTI,윤홍 CTIYunhong CTI Ltd윤홍 CTI는 미국 전역과 기타 여러 국가에서 다양한 소비자 제품을 개발 생산 유통 및 판매한다.이 회사는 미국에서 상업용 및 산업용 필름 제품을 생산하고 벌룬 파우치 상업용 포장용 필름 등의 필름 제품을 개발한다.이 회사의 주요 제품 라인에는 호일 및 라텍스 풍선과 기타 공기 주입식 장난감 품목으로 구성된 노벨티 제품과 식품 기타 상업용 또는 포장용 플렉시블 필름이 포함된다.또한 이 회사는 Candy Blossoms(사탕 부케)의 조립 및 판매와 멕시코에서 파티 용품 제품의 유통에도 관여하고 있다.이 회사는 미국 캐나다 멕시코 및 기타 여러 국가에서 호일 및 라텍스 풍선과 관련 품목을 제공한다.
2227,CTIC,CTI 바이오파머,CTI 바이오파머CTI Biopharma CorpCTI 바이오파머는 환자 및 의료 제공업체에 대한 혈액 관련 암의 스펙트럼을 포함하는 표적 치료법의 획득 개발 및 상용화에 초점을 맞춘 바이오팜 회사입니다.본 업체는 주로 유럽 연합의 특정 국가에서 재발 또는 내화성 공격성 B세포 비호지킨 림프종(NHL) 증식을 위해 PIXUVRI를 상용화하는 데 주력하고 있습니다.미엘로피브로시스로 성인 환자의 치료를 위한 pacritinib 평가에도 관여하고 있습니다.초기 단계 제품 후보인 Tosedostat는 급성 골수성 백혈병 환자들에 대한 반응을 보여 준 구강 일일 아미노펩티다제 억제제입니다.또한 고체 종양을 대상으로 하는 파이프라인 후보 Paclitaxel poliglumex(Opaxio)도 평가합니다.난소암 환자에 대해 진행 중인 정비요법 재판 등 협력단체 후원 재판과 수사관 후원 재판(IST)을 통해 오팩시오를 평가하고 있습니다.
2228,CTKB,사이텍 바이오사이언시스,사이텍 바이오사이언시스Cytek Biosciences Inc사이텍 바이오사이언시스는 세포 분석 솔루션 회사다. 이 회사는 기술적 접근 방식을 활용하여 세포 분석 도구를 제공한다.이 회사의 장비인 Aurora 및 Northern Lights 시스템은 여러 레이저의 형광 시그니처 스펙트럼을 활용하여 단일 세포의 형광 태그를 구별함으로써 세포 분석을 제공할 수 있는 스펙트럼 유세포 분석기다(Full Spectrum Profiling(FSP)).회사의 FSP 기술은 빛 감지 및 분배 방법을 활용하는 광학 및 전자 설계를 통해 감도와 정확도를 최적화한다.FSP 플랫폼에는 계측기인 Aurora 및 Northern Lights 시스템 세포 분류기인 Aurora 세포 분류기(CS) 시약 소프트웨어 및 서비스가 포함되어 있어 고객에게 통합된 솔루션 제품군을 제공한다.
2229,CTLP,칸타루프,칸타루프Cantaloupe Inc칸타루프는 무인 소매 시장을 위한 기술 솔루션을 제공하는 디지털 결제 및 소프트웨어 서비스 회사이다.이 회사는 셀프 서비스 상거래를 위한 단일 플랫폼을 제공하며 여기에는 재고 관리 사전 조립 경로 물류 창고 및 백오피스 관리를 처리하는 통합 결제 처리 및 소프트웨어 솔루션이 포함된다.이 회사의 하드웨어에는 통합 결제 장치인 ePort와 회사의 POS 단말기인 Yoke POS가 포함되어 있다.이 단말기는 자판기 마이크로 마켓 오락 아케이드 상업용 세탁 공기/진공 세차 등과 같은 셀프 서비스 무인 시장 애플리케이션에 배치된다.다양한 스타일로 제공되는 ePort 제품은 결제 정보를 캡처하고 결제 시스템 승인을 위해 플랫폼으로 전송함으로써 디지털 결제를 용이하게 한다.Yoke POS 제품은 소비자가 셀프 계산대 모델을 통해 상품을 구매할 수 있도록 태블릿과 같은 경험을 제공한다.
2230,CTLT,캐털란트,캐털란트Catalent Inc캐털란트는 약물 세포 및 유전자 치료 생물제제 백신 및 소비자 건강 제품을 위한 개발 및 제조 솔루션 제공업체이다.이 회사는 생물학적 제제 연질 겔 및 구강 기술 구강 및 전문 전달 임상 공급 서비스를 통해 운영된다.생물학적 제제 부문은 단백질 플라스미드 DNA mRNA 세포 요법 바이러스 백신 및 바이러스 기반 유전자 요법의 개발 및 제조를 제공한다.연질 겔 및 구강 기술 부문은 연질 캡슐의 제형 개발 및 제조 서비스와 경구 고체 투여 형태 제조에 관여한다.경구 및 전문 전달 부문은 통합 다운스트림 임상 개발 및 상업적 공급 솔루션과 함께 다양한 기술에 걸쳐 제형 개발 및 제조를 제공한다.임상 공급 서비스 부문은 의약품 생물학적 제제 및 임상 시험에 대한 제조 포장 보관 유통 및 재고 관리를 제공한다.
2231,CTM,카스텔럼,카스텔럼Castellum Inc카스텔럼은 방위 중심 기술 회사이다. 이 회사는 사이버 보안 정보 기술 정보 전쟁 전자 전쟁 소프트웨어 엔지니어링 데이터 분석 및 프로그램 지원과 같은 분야에서 기술 회사를 인수하고 성장시키는 데 관여하고 있다.이 회사의 자회사에는 Corvus Consulting LLC Specialty Systems Inc.(SSI) MainNerve Federal Services Inc.(MFSI) 및 Merrison Technologies LLC가 있다.Corvus Consulting은 연방 정부 및 상업 고객에게 과학 엔지니어링 기술 운영 지원 및 교육 서비스를 제공하는 데 종사하고 있으며 사이버 공간 작전 전자전 정보 작전 정보 작전 합동/전자파 스펙트럼 작전에 중점을 둔다.SSI는 소프트웨어 엔지니어링 사이버 보안 시스템 엔지니어링 프로그램 지원 및 네트워크 엔지니어링 분야에서 McGuire-Dix-Lakehurst 합동 기지에 있는 해군에 주요 임무 지원을 제공한다.
2232,CTMX,사이톰엑스 테라퓨틱스,사이톰엑스 테라퓨틱스CytomX Therapeutics Inc사이톰엑스 테라퓨틱스는 임상 단계 종양학 중심의 바이오제약 회사입니다.당사는 Probody 기술 플랫폼을 사용하여 임상적으로 검증된 목표물에 대한 암 면역 치료제를 만들고 약물을 복용하기 어려운 목표물에 대한 암 치료법을 개발합니다.당사의 파이프라인은 전신암 면역 치료제 전신 약품 접합제 T세포가 관여하는 프로신체 비스페리틱스 그리고 ProCAR-NK 세포 치료제 등이 있습니다.당사의 제품에는 CX-072 CX-2009 CX-2029 Cytotoxic T-lymphocyte 관련 단백질 4(CTLA-4) 및 CX-188이 포함됩니다.Probody 플랫폼은 종양 조직의 활성 보호제를 사용하여 단일 클론 항체 기반 치료를 가능하게 합니다.Probody 치료법은 CX-072가 지시하는 면역-종양학에서 임상적으로 검증된 암 표적과 CX-2009가 지시하는 차별화 클러스터와 같은 표적들을 다룹니다.
2233,CTO,CTO 리얼티 그로스,CTO 리얼티 그로스CTO Realty Growth IncCTO 리얼티 그로스는 부동산회사이다. 이 회사는 미국 내 다양한 시장에서 약 270만 평방 피트의 소득 재산과 순수 임대 부동산 투자 신탁인 (PINE)의 약 15.6%의 지분을 소유하고 있다.이 회사는 소득 재산 관리 서비스 상업 대출 투자 부동산 운영 부문으로 구성된다.이 회사는 미국 전역의 11개 주에 위치한 약 22개의 소득 부동산을 소유하고 있다.이 회사의 관리 서비스 부문은 수수료 기반 매니지먼트 사업을 상업대출투자 부문은 상업대출 포트폴리오를 포함한다.부동산 운영 부문에는 플로리다 주 19개 카운티의 약 370000개의 지하 에이커로 구성된 광물 관련 포트폴리오와 신용완화가 포함되어 있다.
2234,CTO PR A,CTO 리얼티 그로스 우선주 시리즈 A 6.375%,CTO 리얼티 그로스 우선주 시리즈 A 6.375%CTO Realty Growth 6 375 Cumulative Redeemable Pref Shs Series ACTO 리얼티 그로스는 부동산회사이다. 이 회사는 미국 내 다양한 시장에서 약 270만 평방 피트의 소득 재산과 순수 임대 부동산 투자 신탁인 (PINE)의 약 15.6%의 지분을 소유하고 있다.이 회사는 소득 재산 관리 서비스 상업 대출 투자 부동산 운영 부문으로 구성된다.이 회사는 미국 전역의 11개 주에 위치한 약 22개의 소득 부동산을 소유하고 있다.이 회사의 관리 서비스 부문은 수수료 기반 매니지먼트 사업을 상업대출투자 부문은 상업대출 포트폴리오를 포함한다.부동산 운영 부문에는 플로리다 주 19개 카운티의 약 370000개의 지하 에이커로 구성된 광물 관련 포트폴리오와 신용완화가 포함되어 있다.
2235,CTOS,커스텀 트럭 원 소스,커스텀 트럭 원 소스Custom Truck One Source Inc커스텀 트럭 원 소스는 특수 장비 제공업체이다. 이 회사는 북미 지역의 전기 유틸리티 전송 및 배전 통신 철도 및 기타 기반 시설 관련 산업에 특수 장비를 제공한다.이 회사는 장비 렌탈 솔루션(ERS)과 트럭 및 장비 판매(TES)의 두 부문을 통해 운영된다.장비 임대 솔루션 부문은 트럭 탑재 공중 리프트 크레인 서비스 트럭 덤프 트럭 트레일러 굴착 데릭 및 기타 기계 및 장비를 포함한 다양한 신규 및 중고 특수 장비를 소유하고 있다.트럭 및 장비 판매 부문은 고객의 특정 요구 사항을 충족시킬수 있도록 최종 시장에서 사용할 다양한 신규 장비를 판매한다.또한 이 회사는 중요한 기반 시설 자산의 유지 보수 수리 업그레이드 설치를 위한 서비스를 유틸리티 및 계약자를 포함한 다양한 고객에게 제공한다.이 회사는 약 9000대의 장비를 소유하고 있다.
2237,CTRA,코테라 에너지,코테라 에너지Coterra Energy Inc코테라 에너지는 독립 석유 및 가스 회사다. 이 회사는 석유 천연가스 및 천연가스 액체(NGL)의 개발 탐사 및 생산에 종사한다.주로 텍사스 서부와 뉴멕시코 남부의 Permian 분지 펜실베이니아 북동부의 Marcellus 셰일 오클라호마 중부 대륙 지역의 Anadarko 분지 등 세 개의 운영 지역에서 사업을 운영한다.Permian 분지 자산은 약 307000 순 에이커의 면적을 보유하고 있다.Marcellus 셰일 자산은 마르셀러스 셰일의 건식 가스 창에 약 183000 순 에이커를 보유하고 있다.Anadarko Basin 자산은 약 182000 순 에이커를 보유하고 있다.또한 다수의 천연가스 채집 및 염수 채집 및 처리 시스템을 운영한다.이 회사는 산업 고객 지역 유통 회사 석유 및 가스 마케터 파이프라인 회사 발전 시설 등 다양한 고객에게 석유 천연가스 및 NGL을 판매한다.
2238,CTRE,케어트러스트 리츠 (REIT),케어트러스트 리츠 (REIT)CareTrust REIT Inc케어트러스트 리츠 (REIT)는 자체 관리 자체 운영 부동산 투자 신탁(REIT)이다.이 회사는 주로 전문 간호 노인 주택 및 기타 의료 관련 부동산의 소유 취득 개발 및 임대에 종사한다.이 회사의 부동산 포트폴리오는 캘리포니아 텍사스 루이지애나 아이다호 애리조나 등 약 28개 주에 위치한 약 216개의 전문 요양 시설(SNF) 복합 서비스 캠퍼스 생활 보조 시설(ALF) 독립 생활 시설(ILF)로 구성되며 운영 병상 수는 22831개 이상이다.SNF는 사람들에게 회복 재활 및 간호 서비스를 제공하는 허가된 의료 시설이다.ALF는 목욕 식사 옷 입기 의료 서비스 등 일상 생활 활동에 도움이 필요한 사람들에게 개인 간호 서비스 지원 및 주거를 제공하는 허가된 의료 시설이다.ILF는 은퇴자 커뮤니티 또는 시니어 아파트라고도 한다.
2239,CTRM,캐스터 마리타임,캐스터 마리타임Castor Maritime Inc캐스터 마리타임은 사이프러스에 기반을 둔 기업이다. 이 기업은 벌크 화물선을 소유 및 운영하며 전세계 건화물 해양 운송 사업을 하고 있다.또한 신규 및 현대식의 선박을 인수함으로써 규모를 키울 목적을 갖고 있다.
2240,CTRN,시티 트렌즈,시티 트렌즈Citi Trends Inc시티 트렌즈는 아프리카계 미국인 및 라틴계 가족을 위한 의류 액세서리을 제공하는 트렌드 전문 소매업체이다.이 회사는 33개 주의 도시 교외 지방에서 약 600개의 매장을 운영하고 있다.이 회사는 패션 스포츠웨어 아우터웨어 잠옷 란제리 스크럽 제품 등 주니어 및 여성 의류(플러스 사이즈) 를 포함한 다양한 상품을 제공한다.이 회사는 또한 남성과 여성을 위한 패션 핸드백 여행가방 모자 벨트 선글라스 보석 시계뿐만 아니라 여성과 남성을 위한 기본 속옷 미용 및 향수 제품도 제공한다.
2241,CTS,CTS,CTSCTS CorpCTS는 센서 연결 부품 및 액추에이터의 글로벌 제조업체다. 이 회사는 주로 항공우주 및 방위 산업 의료 운송 시장을 위한 주문자 상표 부착 생산(OEM) 및 공급업체에 센서 연결 부품 액추에이터 제품군을 설계 제조 판매한다.이 회사는 북미 아시아 및 유럽 전역에 제조 시설을 운영하며 전 세계 다양한 시장에 서비스를 제공한다.이 회사의 제품은 승용차 또는 상용차에 사용되는 센서 및 액추에이터 통신 인프라 정보 기술 및 기타 고속 애플리케이션에 사용되는 연결 부품 여러 시장에 공급되는 스위치 온도 센서 및 전위차계 주로 의료 산업 항공우주 및 방위 시장에 사용되는 가공 압전 재료 및 기판 등이다.
2242,CTSH,코그니전트 테크놀로지 솔루션,코그니전트 테크놀로지 솔루션Cognizant Technology Solutions Corp코그니전트 테크놀로지 솔루션는 전문 서비스 회사이다. 이 회사의 서비스에는 디지털 서비스 및 솔루션 컨설팅 애플리케이션 개발 시스템 통합 애플리케이션 테스트 애플리케이션 유지보수 인프라 서비스 및 비즈니스 프로세스 서비스가 등이 있다.이 회사는 사물 인터넷(IoT) 디지털 엔지니어링 데이터 및 클라우드와 같은 영역에 중점을 두고있다.이 회사는 금융 서비스 의료 제품 및 자원 통신 미디어 및 기술의 4개 부문을 통해 운영된다.이 회사의 의료 부문은 제약 생명 공학 및 의료 기기 회사를 포함한 생명 과학 회사뿐만 아니라 의료 제공자 및 지불인으로 구성된다.제품 및 자원 부문에는 제조업체 소매업체 여행 및 숙박업관련 회사와 물류 에너지 유틸리티 서비스제공 회사 포함된다.커뮤니케이션 미디어 및 기술 부문에는 정보 미디어 및 엔터테인먼트 커뮤니케이션 및 기술 회사가 포함된다.
2243,CTSO,사이토소벤츠,사이토소벤츠Cytosorbents Corp사이토소벤츠는 중환자 중심의 면역 치료 회사입니다. 당사는 다발성 장기부전을 예방하거나 치료하는데 초점을 맞춘 혈액 정화 기술인 CytoSorb의 상품화에 종사하고 있습니다.당사의 정화 기술은 모공 포획 및 표면 흡착을 통해 혈액 및 기타 체액에서 독성 물질을 제거하는 생체 적합 다공성 폴리머 비드를 기반으로 합니다.당사의 사이토소브는 외측성 시토카인 필터이며 패혈증 화상 부상 외상 폐 부상 췌장염과 같은 흔한 중병에 염증 장기 기능 상실 및 사망을 일으키는 시토카인 폭풍을 줄이도록 설계되었다.또한 CytoSorb는 심장 수술과 자가면역 질환 플레어 암 캐시시아와 같은 다른 염증 조건에 사용됩니다.또한 HemoDefend ContrastSorb DrugSorb BetaaSorb 등 혈액 정화 기술을 기반으로 개발 중인 다른 제품도 있습니다.
2244,CTV,이노비드,이노비드Innovid Corp이노비드는 커넥티드 TV(CTV) 모바일 TV 데스크톱 TV 환경 전반에 걸쳐 TV 광고의 생성 전달 측정을 위한 광고 서비스 및 크리에이티브 서비스를 광고주 퍼블리셔 및 미디어 대행사에 제공하는 독립 소프트웨어 플랫폼이다.이 회사는 Anheuser-Busch InBev CVS Pharmacy Kellogg's Mercedes-Benz Target Sanofi Volvo를 비롯한 다양한 TV 광고주에게 서비스를 제공한다.이 회사는 클라이언트가 모든 광고 캠페인 정보 및 크리에이티브 자산을 제출하는 데 사용하는 웹 기반 포털인 Campaign Submission Form 캠페인 구현 및 관리를 위한 플랫폼 포털인 Campaign Management Tool 게재 잠재고객 도달 기기 분석 조회가능성 확인 등을 기준으로 필터링할 수 있는 광고 실적의 통합 시각화를 제공하는 Analytics Dashboard등의 솔루션을 제공한다.또한 이 회사는 Adobe 및 Google Web Designer 플러그인을 제공하여 광고 생성 및 데이터 피드 적용을 간소화한다.
2245,CTVA,코르테바,코르테바Corteva Inc코르테바는 농업 산업에 초점을 맞춘 종자 및 작물 보호 솔루션을 제공하는 글로벌 기업이다.종자 부문은 전 세계 농장에 최적의 수확량을 생산하는 생식세포와 형질을 개발 및 공급하는 데 주력한다.이 부문은 날씨 질병 곤충 및 잡초 방제에 사용되는 제초제에 대한 저항성을 향상시키는 형질 기술과 식품 및 영양 특성을 향상시키는 형질 기술을 제공하고 농부의 의사 결정을 지원하는 디지털 솔루션을 제공한다.작물 보호 부문은 잡초 곤충 및 기타 해충 질병으로부터 보호하고 질소 관리 및 종자 적용 기술을 통해 지상과 지하 모두에서 전반적인 작물 건강을 개선하는 제품으로 전 세계 농업 투입물 산업에 서비스를 제공한다.이 부문에서는 제초제 살충제 질소 안정제 목초지 및 목장 관리용 제초제를 제공한다.브랜드 포트폴리오에는 Pioneer 종자 Brevant 종자 Dairyland 종자 등이 있다.
2246,CTXR,시티우스 파마슈티컬스,시티우스 파마슈티컬스Citius Pharmaceuticals Inc시티우스 파마슈티컬스는 전문 제약회사이다. 이 회사는 항감염 제품을 중심으로 암 치료 처방 제품 간엽줄기세포 치료제를 개발 상용화하고 있다.이 회사의 제품에는 Mino-Lok Mino-Wrap Halo-Lido NoveCite and I/ONTAK등이 있다.Mino-Lok은 감염된 카테터를 인양해 카테터 관련 혈류 감염 환자를 치료하는 데 사용되는 항생제 잠금 솔루션이다.Mino-Wrap은 유방 재건 수술 후 조직 확장기 감염을 줄이기 위한 액화 젤 기반 랩이다.Halo-Lido는 코르티코스테로이드-리도카인 국소 제제로 치질을 앓고 있는 사람들에게 소염 및 마취 완화를 제공하기 위한 것이다.Novecite는 ARDS 치료를 위한 중간엽 줄기세포 치료제이다.I/ONTAK는 지속성 또는 재발성 피부 T세포 림프종 환자를 치료하기 위한 IL-2 디프테리아 독소 융합 단백질이다.
2248,CUBB,Customers Bancorp 5.375% Subordinated Notes Exp 2034,Customers Bancorp 5.375% Subordinated Notes Exp 2034Customers Bancorp 5.375% Subordinated Notes Exp 2034커스터머스 뱅코프는 고객은행(The Bank)을 통해 은행 활동을 하고 있는 은행 지주회사이다.이 은행은 지역사회 은행 사업에 초점을 맞춘 단일 연락 프라이빗 뱅킹 전략을 통해 대출 활동을 다각화하고 고객에게 서비스를 제공하고 있다.이 은행은 상업 산업 상업용 부동산 대출과 펜실베이니아 뉴저지 뉴욕 뉴잉글랜드 및 기타 지역의 대출자에 대한 상업용 부동산 대출 다세대 대출 중소기업 관리(SBA) 대출 주택 담보 대출등을 제공한다.이 은행은 또한 모기지 은행 사업에 대한 상업 대출 상업 장비 금융 핀테크 기업과의 관계를 통한 전문 대출 소비자 대출 등 전국적으로 전문 틈새 사업을 제공한다.이 은행은 TassatPay 블록체인 기반 B2B(Instant Business to Business) 결제 플랫폼에 있는 CBIT 를 출시했다.이 플랫폼은 즉각적인 결제의 혜택을 원하는 B2B 고객들을 위해 서비스를 제공한다.
2249,CUBE,큐브스마트,큐브스마트CubeSmart큐브스마트는 자체 관리 및 자체 경영 부동산 회사다. 이 회사는 미국 내 셀프 스토리지 부동산의 소유 운영 관리 인수 및 개발에 종사한다.24개 주와 컬럼비아 특별구에 위치한 611개의 셀프 스토리지 부동산을 소유하고 있으며 총 임대 가능 면적은 약 4410만 평방 피트에 달한다.애리조나 캘리포니아 콜로라도 코네티컷 플로리다 조지아 일리노이 인디애나 메릴랜드 매사추세츠 미네소타 네바다 뉴저지 뉴멕시코 뉴욕 노스캐롤라이나 오하이오 펜실베이니아 로드 아일랜드 사우스 캐롤라이나 테네시 텍사스 유타 버지니아 등 24개 주에 매장을 소유하고 있다.또한 6개의 별도 비연계 부동산 벤처의 일부로 총 약 560만 평방피트의 순 임대 가능 면적을 보유한 77개 매장을 포함하여 타사를 위해 668개의 매장을 관리한다.셀프 스토리지 부동산은 주거 및 상업용 고객에게 저장 공간을 제공한다.
2250,CUBI,커스터머스 뱅코프,커스터머스 뱅코프Customers Bancorp Inc커스터머스 뱅코프는 고객은행(The Bank)을 통해 은행 활동을 하고 있는 은행 지주회사이다.이 은행은 지역사회 은행 사업에 초점을 맞춘 단일 연락 프라이빗 뱅킹 전략을 통해 대출 활동을 다각화하고 고객에게 서비스를 제공하고 있다.이 은행은 상업 산업 상업용 부동산 대출과 펜실베이니아 뉴저지 뉴욕 뉴잉글랜드 및 기타 지역의 대출자에 대한 상업용 부동산 대출 다세대 대출 중소기업 관리(SBA) 대출 주택 담보 대출등을 제공한다.이 은행은 또한 모기지 은행 사업에 대한 상업 대출 상업 장비 금융 핀테크 기업과의 관계를 통한 전문 대출 소비자 대출 등 전국적으로 전문 틈새 사업을 제공한다.이 은행은 TassatPay 블록체인 기반 B2B(Instant Business to Business) 결제 플랫폼에 있는 CBIT 를 출시했다.이 플랫폼은 즉각적인 결제의 혜택을 원하는 B2B 고객들을 위해 서비스를 제공한다.
