i,코드,기업명,내용,
1687,CDRO,코더 온라인 룩셈부르크,코더 온라인 룩셈부르크Codere Online Luxembourg SA코더 온라인 룩셈부르크는 룩셈부르크에 기반을 둔 온라인 카지노 운영자 회사다.이 회사는 최첨단 웹사이트와 모바일 애플리케이션을 통해 온라인 스포츠 베팅 및 온라인 카지노를 제공한다.이 회사는 스페인 이탈리아 멕시코 콜롬비아 파나마 및 부에노스 아이레스 시(아르헨티나)에서 운영된다.이 회사는 옴니채널과 완전 온라인을 포함하는 온라인 채널을 제공한다.완전 온라인 채널은 2021년 기준으로 순 게임 수익의 약 79%를 차지한다.이 회사의 상품에는 스포츠 베팅 및 카지노가 포함된다. 스포츠 베팅은 2021년 현재 순 게임 수익의 56%를 차지하며 회사의 순 게임 수익은 2021년 기준으로 8300만 유로이다.
1688,CDTX,시다라 테라퓨틱스,시다라 테라퓨틱스Cidara Therapeutics Inc시다라 테라퓨틱스는 새로운 항감염제 개발에 주력하는 임상 단계 생명공학 회사입니다.당사의 주요 제품 후보는 레자풍인 아세테이트로 고사망률과 연관된 진균성 감염 칸디다스 침습성 누드리아스 등 심각한 침습성 곰팡이 감염의 치료와 예방을 위한 항균류 등급의 분자입니다.또한 당사는 새로운 Cloudbreak 플랫폼을 활용하여 심각한 바이러스 및 Gram 음성 세균 감염의 치료를 위한 항체-약물 접합부를 개발하고 있습니다.Cloudbreak는 병원균을 직접 죽이고 환자의 면역세포가 박테리아 곰팡이 또는 바이러스 병원균을 공격하고 제거하도록 지시하는 화합물을 만들기 위해 특별히 고안된 면역치료 발견 플랫폼입니다.
1689,CDW,CDW,CDWCDW CorpCDW는 미국 영국 캐나다의 중소기업 정부 교육 및 의료 고객에게 정보 기술(IT) 솔루션을 제공하는 멀티 브랜드 기술 회사다.이 회사는 개별 하드웨어 및 소프트웨어 제품부터 하이브리드 인프라 디지털 경험 및 보안 전반에 걸친 온프레미스 및 클라우드 기능을 포함하는 통합 IT 솔루션 및 서비스에 이르기까지 다양한 제품을 제공한다.이 회사의 사업 부문에는 기업 중소기업 공공 부문이 포함된다.기업 부문과 중소기업 부문은 주로 미국 민간 부문 비즈니스 고객에게 서비스를 제공한다.공공 부문은 미국의 정부 기관 교육 및 의료 기관으로 구성된다.이 회사의 솔루션은 물리적 가상 및 클라우드 기반 환경에서 제공된다.
1691,CDXC,크로마덱스,크로마덱스Chromadex Corp크로마덱스는 나이가 들수록 수치가 감소하는 니코틴아미드 아데닌 디뉴클레오티드(NAD+)에 대한 연구에 종사하는 글로벌 생명과학 회사이다.이 회사의 NAD+는 조효소이며 세포 대사의 조절자이다. 이 회사는 소비자 제품 성분 분석 참조 표준 및 서비스 부문의 세 가지 부문을 통해 운영된다.소비자 제품 부문은 소비자와 유통업체에 직접 성분을 포함하는 완성된 식이 보조제 제품을 제공한다.성분 부문은 성분 기술을 개발 및 상업화하고 이러한 성분을 소비자 제품 제조업체에 원료로 공급한다.이 회사의 분석 참조 표준 및 서비스 부문은 phytochemical(피토케미컬)에 대한 표준 및 기타 연구 및 개발 서비스를 제공한다.대표적인 phytochemical의 성분으로는 Tru Niagen과 Immulina가 있으며 Tru Niagen은 니코틴아미드 리보사이드(NR) 형태이며 NR은 비타민 B3 계열의 구성원 Immulina는 스피루리나 추출물이다.
1692,CDXS,코덱시스,코덱시스Codexis Inc코덱시스는 효소 공학 회사이다. 이 회사는 효소 및 기타 단백질을 발견 개발 판매하는 일에 종사하고 있다.이 회사는 성능 효소와 새로운 생체 요법의 두 가지 부문을 통해 운영된다.이 회사의 CodeEvolver 기술 플랫폼은 시작 효소를 생체 촉매 또는 치료 후보로 변환하여 생물학적 발견을 가속화한다.이 회사는 제약 시장에서 CodeEvolver 단백질 엔지니어링 기술 플랫폼과 제품을 상용화했다.이 회사의 제품에는 생체 촉매 화학 중간체 및 Codex 생체 촉매 패널 및 키트가 포함된다.이 회사는 또한 차세대 시퀀싱에 사용되는 Codex HiFi DNA 중합효소 분자 진단 응용 분야에 사용하는 Codex HiTemp 역전사효소 RNA 합성 응용에 사용하는 Codex HiCap RNA 중합효소와 같은 3가지 추가 효소를 상업화했다.이 회사는 고페닐알라닌혈증(HPA) 치료를 위한 리드 프로그램인 CDX-6114를 개발하고 있다.
1693,CDZI,카디즈,카디즈Cadiz Inc카디즈는 토지 및 수자원 개발 회사입니다. 2016년 12월 31일 현재 당사는 캘리포니아주 샌버너디노 카운티 동부 3개 지역에 45000에이커의 토지를 보유하고 있습니다.당사의 주요 사업은 지하수 공급 지하수 저장 농업 등 다양한 용도의 수자원으로 토지를 취득하고 개발하는 것입니다.2016년 12월 31일 현재 Cadiz 및 Fenner 계곡 동부의 Cadiz 및 Fenner 계곡에 있는 34000에이커의 재산 하에 있는 대수층 시스템의 증발로 인해 토착 지하수가 손실되는 것을 포착하고 보존하는 Cadiz Valley 수질 복구 및 저장 프로젝트(Water Project Project)의 개발에 주력하고 있습니다.디노 카운티(Cadiz/Fenner Property)는 캘리포니아 남부 전역의 물 공급자에게 전달합니다.당사의 개발 활동에는 수자원 및 샌버나디노 카운티 재산의 농업 개발이 포함됩니다.
1695,CE,셀라니즈 코퍼레이션,셀라니즈 코퍼레이션Celanese Corp셀라니즈 코퍼레이션은 글로벌 화학 및 특수 소재 회사다. 이 회사는 다양한 응용 분야에 사용되는 엔지니어링 폴리머를 생산한다.사업 부문으로는 엔지니어링 소재와 아세틸 사슬이 있다. 엔지니어링 소재 부문은 자동차 및 의료용은 물론 산업 제품 및 가전제품에 사용되는 다양한 특수 폴리머를 개발 생산 및 공급한다.이 부문은 또한 식음료 산업에 아세설팜 칼륨을 공급하고 소르빈산 칼륨 및 소르빈산과 같은 식품 보호 성분을 생산한다.아세틸 체인 부문은 중간 화학 에멀젼 폴리머 에틸렌 비닐 아세테이트(EVA) 폴리머 및 재분산성 분말(RDP) 사업 아세테이트 토우 사업의 통합 체인을 포함한다.또한 모빌리티 및 소재(M&M) 사업에도 종사한다. 폴리옥시메틸렌 초고분자량 폴리에틸렌 장섬유 강화 열가소성 플라스틱 등의 제품을 생산한다.
1696,CEAD,CEA 인더스트리스,CEA 인더스트리스CEA Industries IncCEA 인더스트리스는 전세계 환경 농업(CEA) 산업에 기술 엔지니어링 서비스를 제공하는 회사이다.이 회사의 서비스 및 제품에는 상업규모의 환경 제어 시스템 관련 기계 전기 및 배관(MEP) 엔지니어링 공정 냉각 시스템 기타 기후 제어 시스템 공기 처리 장비 및 시스템 실내 재배를 위한 LED 조명 벤치 및 랙 솔루션 환경 조명 및 기후 제어에 사용되는 자동화 및 제어 장치 시스템 및 기술 CEA 시설에 대한 유지 보수 서비스등을 비롯한 재배 시설의 평면도 및 건축 설계가 포함된다.이 회사는 미국 캐나다 및 기타 국제 지역의 상업 주 및 지방 규제 CEA 재배자에게 서비스를 제공한다.
1697,CECO,CECO 인바이런먼털,CECO 인바이런먼털CECO Environmental CorpCECO 인바이런먼털은 산업 시설에서 배출되는 공기 및 물에 의한 배출물을 포착 청소 및 파괴하는 시스템과 유체 처리 가스 분리 및 여과 시스템의 설계 설계 구축 및 설치에 종사하고 있다.이 회사는 엔지니어링 시스템 부문과 산업 프로세스 솔루션 부문으로 구성된다.엔지니어링 시스템 부문은 발전 정유 물/폐수 및 미드스트림 석유 및 가스 시장을 지원한다.이 부문은 배기 가스 관리 유체 침대 사이클론 열 음향 분리 및 여과 댐퍼 및 팽창 조인트를 포함한 플랫폼을 통해 환경 및 장비 보호를 가능하게 한다.산업 프로세스 솔루션 부문은 산업 대기 오염 제어 음료 캔 유체 처리 전기 자동차 생산 식음료 반도체 공정 여과 제약 석유 화학 폐수 처리 목재 제조 담수화 및 양식 시장을 서비스한다.
1698,CEE,Central and Eastern Europe Fund Inc,Central and Eastern Europe Fund IncCentral and Eastern Europe Fund Inc과거 Central Europe Russia and Turkey Fund였던 센트럴 앤드 이스턴 유럽 펀드는 비양도적이고 폐쇄적인 경영 투자 회사다.그 펀드는 중앙 유럽 러시아 터키에 본사를 둔 발행인의 주식 또는 주식 연계 증권에 대한 투자를 통해 장기간의 시세차익을 추구한다.정상적인 상황에서 펀드는 순자산의 80% 이상(투자목적으로 사용되는 차입금 포함)을 중부유럽 러시아 터키에 본사를 둔 발행인의 증권에 투자한다.이 펀드는 은행 다양한 통신 서비스 전력회사 식품 및 스테이플 소매업 금속 및 광업 석유 가스 및 소모품 연료 무선 통신 서비스 보험 소프트웨어 항공사 화학 산업 대기업 의약품 등 다양한 분야에 투자한다.도이치자산운용 인터내셔널 GmbH는 이 펀드의 투자자문위원이다.
1699,CEF,Sprott Physical Gold and Silver Trust USD,Sprott Physical Gold and Silver Trust USDSprott Physical Gold and Silver Trust USD아이셰어즈 글로벌 헬스 케어 ETF (이전 iShares S&P 글로벌 헬스 케어 섹터 인덱스 펀드)는 ETF (exchange-traded fund)입니다.이 펀드는 일반적으로 S&P Global 1200 Healthcare Sector Index (지수)의 가격 및 수익률 성과에 해당하는 투자 결과를 추구합니다.이 지수는 StandardS&Poor 's Financial Services LLC (S&P)가 경제의 소비재 부문의 일부로 간주하는 회사의 성과를 측정합니다.S&P Global 1200 지수의 일부입니다. 구성 요소 회사에는 의료 서비스 제공 업체 생명 공학 회사 및 의료 용품 제조업체 고급 의료 기기 및 의약품이 포함됩니다.기본 지수는 호주 벨기에 캐나다 덴마크 프랑스 독일 아일랜드 일본 네덜란드 스위스 영국 및 미국을 포함한 국가의 회사 주식으로 구성됩니다.이 펀드의 투자 고문은 BlackRock Fund Advisors (BFA)입니다.
1703,CEG,콘스텔레이션 에너지,콘스텔레이션 에너지Constellation Energy Corp콘스텔레이션 에너지는 청정 에너지 회사이다. 이 회사는 무탄소 전기에 중점을 둔다. 이 회사는 가정 기업 공공 부문 지역 사회 집합체 및 미국 본토 전역의 지방 자치 단체 협동 조합 및 기타 전략과 같은 다양한 도매 고객에게 청정 에너지 및 지속 가능한 솔루션을 제공하는 공급업체이다.이 회사는 재생 가능 에너지 및 기타 에너지 관련 제품 및 서비스를 판매한다.이 회사는 중부 대서양 중서부 뉴욕 ERCOT 및 기타 전력 지역으로 구성된 5개의 보고 가능한 부문을 통해 운영된다.이 회사는 Constellation NewEnergy Inc.와 Exelon Generation Company LLC(Generation)의 두 가지 주요 사업을 갖고있으며 합병된 회사는 약 48개 주 캐나다 및 영국에서 운영된다.
1704,CEI,캠버 에너지,캠버 에너지Camber Energy Inc캠버 에너지는 다각화된 에너지 회사이다. 이 회사는 자회사인 Viking Energy Group Inc.(Viking)를 통해 북미의 상업 및 산업 고객에게 맞춤형 에너지 및 전력 솔루션을 제공하고 미국의 석유 및 천연 가스 자산에 대한 지분을 소유하고 있다.이 회사는 텍사스 루이지애나 미시시피의 다양한 생산 지질층에서 원유 천연 가스 천연 가스 액체의 인수 개발 및 판매에 종사하고 있다.이 회사의 속성에는 개발 전망과 함께 활성 재래식 유정 및 가스정이 포함된다.유정은 걸프 연안 지역의 다양한 저수지/모래에서 탄화수소를 생산한다.이 회사의 자회사는 또한 캐나다에서 특허 받은 탄소 포집 시스템에 대한 라이선스를 보유하고 있으며 오존 기술을 통해 개발된 의료 및 생물학적 위험 폐기물 처리 시스템에 대한 지적 재산권을 소유한 기업의 지분을 보유하고 있다.
1705,CEIX,콘솔 에너지,콘솔 에너지CONSOL Energy Inc콘솔 에너지는 고열량 유연탄 및 야금 석탄의 생산 및 수출업체다.이 회사는 Northern Appalachian Basin에서 롱월 채굴 사업을 소유 및 운영한다.주력 사업장은 피츠버그에서 남서쪽으로 약 26마일 떨어진 워싱턴 시 근처에 위치한 펜실베니아 광산 단지다.펜실베니아 광산 단지는 Bailey 광산 Enlow 포크 광산 Harvey 광산 중앙 집중식 석탄 처리 시설 및 열차 적재 시설로 구성된다.이 회사는 PAMC와 CONSOL 해상 터미널 두 가지 부문을 통해 운영된다.PAMC 부문에는 Bailey 광산 Enlow 포크 광산 Harvey 광산 및 중앙 집중식 준비 공장이 포함된다.PAMC 부문의 주요 활동에는 유연탄의 채굴 준비 및 마케팅이 포함되며 주로 발전기 산업 최종 사용자 및 야금 최종 사용자에게 판매된다.CONSOL 해양 터미널 부문은 볼티모어 항구를 통해 석탄 수출 터미널 서비스를 제공한다.
1706,CELC,셀큐이티,셀큐이티Celcuity Inc셀큐이티는 임상 단계의 생명 공학 회사이다. 이 회사는 동반 진단 테스트(CDx) 및 치료제(Rx) 개발을 통해 암 하위 유형의 분자 기반 접근 방식을 찾는 데 주력하고 있다.이 회사의 제품 파이프라인에는 CELsignia 플랫폼과 Gedatolisib이 있다.CELsignia 진단 플랫폼은 환자의 암과 표적 치료를 유발하는 비정상적인 세포 과정을 식별하기 위해 살아있는 환자의 종양 세포를 분석하는 데 사용된다.CELsignia 플랫폼은 전통적인 분자 진단을 제공하며 여기에는 환자 종양에 존재하는 유전적 돌연변이의 스냅샷이 포함된다.분자 진단은 세포 조각을 분석함으로써 약물 임상 시험 결과의 통계 분석을 기반으로 환자의 잠재적인 약물 반응을 추정할 수 있다.이 회사의 다른 제품 후보에는 소분자 이중 억제제로 정맥내 투여되는 Gedatolisib이 있다.
1707,CELG RT,Bristol Myers Squibb Company Contingent Rights Exp 31 Dec 2030,Bristol Myers Squibb Company Contingent Rights Exp 31 Dec 2030Bristol Myers Squibb Company Contingent Rights Exp 31 Dec 2030브리스톨-마이어스 스큅은 생명의약품의 발굴 개발 라이선스 제조 마케팅 유통 판매에 종사하는 회사이다.이 회사의 의약품에는 화학적으로 합성된 약물 혹은 소분자와 생물학적 공정에서 생산된 생물학적 제제가 포함된다.이 회사의 소분자 약물은 알약 또는 정제 형태로 경구 투여된다. 이 회사의 생물학적 제제는 주사 또는 주입을 통해 환자에게 투여된다.이 회사의 제품에는 Revlimid Abraxane Reblozyl Inrebic Onureg Zeposia Vidaza Empliciti Opdivo Sprycel Yervoy Eliquis Orencia Baraclude Reyataz Sustiva가 있다.이 회사는 종양학 면역학 심혈관 섬유증을 포함하는 다양한 치료 등급을 위한 제품을 제공한다.이 회사의 제품은 전 세계의 도매업체 소매 약국 병원 정부 기관 의료 전문가에게 판매된다.
1708,CELH,셀시어스 홀딩스,셀시어스 홀딩스Celsius Holdings Inc셀시어스 홀딩스는 다양한 소비자를 대상으로 기능성 음료 및 액상 보충제의 개발 가공 마케팅 판매 및 유통에 종사하고 있다.이 회사의 핵심 제품에는 운동 전후의 기능성 에너지 음료와 단백질 바가 포함된다.이 회사의 대표 브랜드는 칼로리 소모 기능성 에너지 드링크인 셀시우스(CELSIUS)다.이 회사는 에너지 음료나 탄산음료에서 발견되는 인공 방부제 없이 칼로리 연소가 되는 MetaPlus를 사용하여 영양 과학을 주류 음료와 결합하고자 한다.CELSIUS는 화학 방부제 아스파탐 또는 고과당 옥수수 시럽이 없으며 나트륨이 적다.CELSIUS는 녹차(EGCG) 생강 칼슘 크롬 비타민 B 비타민 C 등 몸에 좋은 성분과 보충제를 사용한다.이 회사의 제품 라인에는 CELSIUS Originals CELSIUS HEAT CELSIUS BCAA +Energy CELSIUS On-the-Go 및 CELSIUS Sweetened with Stevia가 있다.CELSIUS의 간편 음료 제품은 12온스의 매력적인 포장으로 출시된다.
1709,CELL,피노멕스,피노멕스PhenomeX Inc피노멕스는 기능성 세포 생물학 회사이다. 이 회사는 과학자들이 각 세포를 활용하고 인간의 건강을 향상시킬 차세대 기능성 세포 생물학을 추진할 수 있도록 돕는다.이 회사는 과학자가 세포의 기능을 밝히고 각 세포 행동에 대한 전체적인 정보를 얻을 수 있도록 한다.이 회사의 검증된 도구 및 서비스 제품군은 질병의 예방 및 치료를 위한 핵심적인 통찰력을 제공한다.이 회사의 플랫폼은 다양한 글로벌 제약 회사와 미국 암 센터의 약 85%를 포함한 전 세계 연구원들이 사용한다.
1710,CELU,셀룰레리티,셀룰레리티Celularity Inc셀룰레리티는 임상단계의 생물공학 회사이다. 이 회사는 키메라 항원 수용체(CAR)(CAR-T) 세포 자연 살해(NK) 세포 중간엽 유사 부착 기질 세포(ASC)로 설계된 태반 유래 동종 T 세포 개발에 참여하고 있다.이 세포는 암 감염성질환 퇴행성 질환 전반에 걸친 적응증을 대상으로 한다.이 회사는 4가지 태반 유래 동종이계 세포 유형인 T 세포 비변형 NK 세포 유전적으로 변형된 NK 세포 ASC를 갖고 있으며 이는 4가지 핵심 세포 치료 프로그램을 탄생시켰다.이 세포 프로그램에는 6가지 초기 적응증에 초점을 맞춘 CyCART-19 CYNK-001 CYNK-101 APPL-001가 있다.CyCART-19는 초기에 CD19 수용체를 표적으로 하는 B 세포 악성 종양의 치료를 위해 개발 중인 태반 유래 CAR-T 세포 치료제이다.CYNK-001은 혈액암인 급성골수성백혈병(AML)과 고형암인 다형성교모세포종(GBM) 코로나19 치료제로 개발 중이다.
1711,CELZ,크리에이티브 메디컬 테크놀로지 홀딩스,크리에이티브 메디컬 테크놀로지 홀딩스Creative Medical Technology Holdings Inc크리에이티브 메디컬 테크놀로지 홀딩스는 면역학 비뇨기과 정형외과 및 신경학에 중점을 둔 상업 단계의 생명공학 회사이다.이 회사는 다중 적응증의 치료를 위한 성체 줄기 세포 치료와 상호 연관된 재생 기술을 사용한다.이 회사는 자회사인 Creative Medical Technologies Inc.(CMT)를 통해 운영을 수행한다.이 회사는 남성 발기 부전 및 여성 성기능 장애 시술을 위한 CaverStem 및 FemCelz 일회용 키트를 판매한다.이 회사의 제품에는 CaverStem FemCelz StemSpine Amniostem ImmCelz OvaStem이 있다.CaverStem은 환자 자신의 줄기 세포를 활용하여 발기 부전(ED)을 치료하며 FemCelz는 질 기능 회복을 위한 치료 및 시술에 사용된다.
1712,CEM,ClearBridge MLP and Midstream Closed End Fund,ClearBridge MLP and Midstream Closed End FundClearBridge MLP and Midstream Closed End Fund아이셰어즈 글로벌 테크 ETF  이전 iShares S&P Global Technology Sector Index Fund는 ETF (exchange-traded fund)입니다.이 펀드는 일반적으로 S&P Global 1200 정보 기술 분야 지수 (지수)의 가격 및 수익률 성과에 해당하는 투자 결과를 추구합니다.이 지수는 McGraw-Hill Companies (S&P)의 자회사 인 Standard & Poor 's Financial Services LLC가 경제 정보 기술 분야의 일부로 간주하는 회사의 성과를 측정합니다.S&P Global 1200의 일부입니다. 구성 요소는 주로 정보 기술 및 기술 회사를 포함하며 시간이 지남에 따라 변경 될 수 있습니다.이 펀드는 일반적으로 자산의 90 % 이상을 지수의 유가 증권과 지수의 유가 증권을 나타내는 예금에 투자합니다.BlackRock Fund Advisors는 펀드의 투자 고문입니다.
1715,CENN,센트로 일렉트릭 그룹,센트로 일렉트릭 그룹Cenntro Electric Group Ltd센트로 일렉트릭 그룹은 상업용 전기 자동차(EV) 기술 회사이다.이 회사는 전기 경차 및 상용 중형차(ECV)의 설계 및 제조업체이다.이 회사의 사용 중형차(ECV)는 도시 서비스 배송 및 기타 상업용도를 지원하는 다양한 기업 및 정부 조직에 서비스를 제공하도록 설계되었다.이 회사의 사용 중형차(ECV) 모델에는 Metro Logistar 400 Logistar 200 Neibor 200 및 ORV가 포함된다.이 회사의 비즈니스 모델은 최종 사용자를 위해 ECV를 설계 제조 조립 승인 및 제3자에게 판매할 수 있으며 제조된 차량 키트를 배포할 수 있다.이 회사는 또한 ECV가 위치 속도 가속 제동 및 배터리 소모와 관련된 데이터를 최종 사용자에게 보내고 받을 수 있도록 자체 텔레매틱스 박스를 설계 및 개발했다.
1716,CENT,센트럴 가든 앤드 펫,센트럴 가든 앤드 펫Central Garden & Pet Co센트럴 가든 앤 펫 컴퍼니는 미국의 정원 및 반려동물 산업에 종사하고 있다.사업 부문은 애완 동물 및 정원으로 나뉜다. 애완 동물 부문은 다음을 포함한다. 1.개 간식 및 껌 장난감 애완 동물 침대 및 미용 제품 폐기물 관리 및 훈련 패드 애완 동물 격리와 같은 개 및 고양이 용품 2.장난감 케이지 및 서식지 침구 사료 및 보충제를 포함한 수생 동물 작은 동물 파충류 및 애완용 조류를 위한 용품 3.말 및 가축용 제품 동물 및 가정용 건강 및 해충 방제 제품 4.살아있는 물고기와 작은 동물 및 야외 쿠션.이 제품들은 Aqueon Cadet Comfort Zone Farnam Four Paws K&H Pet Products(K&H) Kaytee Nylabone Zilla 등의 브랜드로 판매되고 있다.정원 부문은 다음을 포함한다. 1.잔디 씨앗 채소 꽃 및 허브 패킷 씨앗과 같은 잔디 및 정원 소모품 2.야생 조류 사료 새집 및 기타 조류 관찰 액세서리 3.잡초 잔디 및 기타 제초제 살충제 및 살충제 제품 4.비료 및 살아있는 식물.
1717,CENTA,센트럴 가든 앤드 펫 Class A,센트럴 가든 앤드 펫 Class ACentral Garden & Pet Co Class A센트럴 가든 앤 펫 컴퍼니는 미국의 정원 및 반려동물 산업에 종사하고 있다.사업 부문은 애완 동물 및 정원으로 나뉜다. 애완 동물 부문은 다음을 포함한다. 1.개 간식 및 껌 장난감 애완 동물 침대 및 미용 제품 폐기물 관리 및 훈련 패드 애완 동물 격리와 같은 개 및 고양이 용품 2.장난감 케이지 및 서식지 침구 사료 및 보충제를 포함한 수생 동물 작은 동물 파충류 및 애완용 조류를 위한 용품 3.말 및 가축용 제품 동물 및 가정용 건강 및 해충 방제 제품 4.살아있는 물고기와 작은 동물 및 야외 쿠션.이 제품들은 Aqueon Cadet Comfort Zone Farnam Four Paws K&H Pet Products(K&H) Kaytee Nylabone Zilla 등의 브랜드로 판매되고 있다.정원 부문은 다음을 포함한다. 1.잔디 씨앗 채소 꽃 및 허브 패킷 씨앗과 같은 잔디 및 정원 소모품 2.야생 조류 사료 새집 및 기타 조류 관찰 액세서리 3.잡초 잔디 및 기타 제초제 살충제 및 살충제 제품 4.비료 및 살아있는 식물.
1718,CENX,센추리 알루미늄,센추리 알루미늄Century Aluminum Co센추리 알루미늄은 1차 알루미늄을 생산하는 글로벌 기업이며 알루미늄 환원 시설 또는 제련소를 운영한다.회사는 미국과 아이슬란드에서 사업을 운영한다. 회사의 1차 알루미늄 환원 시설은 1차 알루미늄 제품을 생산한다.회사의 연간 최대 생산 능력은 연간 약 1016000톤(tpy)이다.1차 알루미늄 자산 외에도 네덜란드(Vlissingen)에 위치한 탄소 음극 생산 시설을 소유하고 있다.탄소 음극재는 1차 알루미늄 생산에 소비된다. Vlissingen은 아이슬란드 Grundartangi에 있는 알루미늄 제련소에 탄소 음극재를 공급한다.미국 내 각 알루미늄 제련소는 현장 시설에서 음극재를 생산한다. Natur-Al 제품 라인을 통해 저탄소 알루미늄 제품을 제공한다.
1719,CEPU,센트럴 푸에르토 ADR,센트럴 푸에르토 ADRCentral Puerto SA ADR센트럴 푸에르토SA는 아르헨티나 기업으로 국내외에서 에너지를 개발하고 생산한다.이 기업은 아르헨티나의 La Castellana I Achiras I La Castellana II 등 재생에너지를 생산하는 곳에서 다양한 풍력 발전소를 운영한다.2016년 이 기업은 SADESA를 인수했다.
